"""대학생 이 얼마나 공부 를 하 지 않 는 집단 이 ㄴ지 생각하 아 보 면 "," 꽤 나 좋 은 수업 방식 이 라고 생각하 ㄴ 다""",,,,,,,,,,,,,,
영문학 과 교수 님 이 시 어서 외국 문화 에 대하 어 잘 알리 어 주 시 고 영화 나 음악도 좋아하 시 어서 여기저기 서 다양 하 ㄴ 이야기 를 하 아 주 시 어서 유익 하 ㅁ,,,,,,,,,,,,,,
굉장히 유익 하 ㄴ 수업 교수 님 과 함께 책 을 읽 어 내려가 던 수업 시간 이 나 즐겁 었 습니다,,,,,,,,,,,,,,
다만 시험 이 많이 어렵 습니다,,,,,,,,,,,,,,
이번 학기 교수 님 께서 많이 바쁘 시 ㄴ 바람 에 다소 허둥지둥 하 시 는 모습 을 보이 어 주 시 었 으나 강의 내용 전달 은 매우 잘 하 아 주 시 어서 꽤 만족,,,,,,,,,,,,,,
들 으면 오히려 본인 한테 손해 .. 듣 고 있 기 시간 아깝 ㄴ 개소리 만 많이 하 ㄹ 뿐 시험 에 도 인생 에 도 도움 안 되 ㅁ,,,,,,,,,,,,,,
특히 문학 을 해석 하고 이해 하 는 것 에 대하 어 많 은 존중 을 하 아 주 시 ㅂ니다,,,,,,,,,,,,,,
진짜 러시아 에 대하 아서 1 도 모르 았 는데 어느 정도 의 흐름 은 알 수 있 었 어요,,,,,,,,,,,,,,
그리고 영상 필기 열심히 하 면서 듣 고 흐름 을 외우 어서 가 니까 ㄴ 시험 도 쉽 게 칠 수 있 었 습니다,,,,,,,,,,,,,,
그래도 중간 를 보 지 않 는다는 점 이 나 크 게 외우 어야 하 ㄹ 것 없이 영상 내용 을 따라가 면서 이해 하 면 되 어서 수업 자체 는 재미있 는 듯 하 ㅁ,,,,,,,,,,,,,,
솔직히 내용 은 막 예술 에 관심 있 는 사람 아니 면 크 게 재미없 을 것 이 ㅂ니다,,,,,,,,,,,,,,
개 꾸 ㄹ 교양 이 ㅁ,,,,,,,,,,,,,,
러시아 에 대하 어 영상 으로 쉽 게 접하 ㄹ 수 있 는 좋 은 수업 이 ㅂ니다,,,,,,,,,,,,,,
다른 교양 A + 받 는 노력 의 반 만 하 어 도 되 ㅁ,,,,,,,,,,,,,,
평가 보 니까 호불호 많이 갈리 는 것 같 네요,,,,,,,,,,,,,,
"""단 "," 예술 에 관심 이 없 으면 수업 시간 이 힘들 수 있 다""",,,,,,,,,,,,,,
기 말 는 100 서술 형 이 다,,,,,,,,,,,,,,
"""같이 우리 가 관심 갖 을 수 있 는 다큐 통하 아서 러시아 지역 별로 소개 해주시 고 그 다음 에 는 순서 는 생각 안 나 는데 미술 ", 음악 ," 영화 등 예술 분야 별로 공부 하 아요""",,,,,,,,,,,,,,
영상 재미없 는 것 도 있 기 ㄴ 하지만 특히 영화 는 진짜 재미있 게 보 았 고 러시아 에 대하 어 많이 알 게 되 ㅁ,,,,,,,,,,,,,,
잘 수 밖에 없 는 수업 이 지만 러시아 가 생각 보다 괜찮 다는 것 을 알리 어 주 ㅁ,,,,,,,,,,,,,,
나름 신경 쓰 어서 공부 하 시 어야 하 아요,,,,,,,,,,,,,,
교수 님 이 도움 되 는 이야기 도 많이 해주시 고 러시아 문화 에 관해 관심 보이 면 좋 게 봐주 시 지만 출석 부르 시 ㄹ 때 뛰어넘 고 부르 시 어서 나중 에 문의 드리 면 두루뭉술 하 게 대답 하 시 는 편 이 라는 것 이 조금 걸리 는 점,,,,,,,,,,,,,,
전반적 으로 러시아 예술 에 대하 ㄴ 교양 을 쌓 는데 많 은 도움 이 되 었 다고 생각 하 ㅁ,,,,,,,,,,,,,,
일단 중간 에 러시아 이론적 이 ㄴ 내용 하 는데 기 말 에 는 거의 안 나오 ㅁ,,,,,,,,,,,,,,
교수 님 의 러시아 에 대하 ㄴ 애정 과 깊이 있 는 식견 을 느끼 ㄹ 수 있 었 습니다,,,,,,,,,,,,,,
진짜 도움 많이 되 ㅂ니다,,,,,,,,,,,,,,
즐겁 었 다 교수 님 께서 조만식 체육관 에 학생 들 세우 어 놓 고 하 ㄴ 바퀴 도시 면서 매 수업 마다 자세 교정 해주시 고 열심히 가르치 어 주심,,,,,,,,,,,,,,
별로 어렵 지 않 아서 처음 하 시 는 분 들 도 수업 시간 에 열심히 참여 하 면 좋 은 등급 받 을 수 있 을 것 같 아 요 추천 하 ㅂ니다,,,,,,,,,,,,,,
수업 .. 나 ㄹ .. 먹 ...... 나 도 강의 평가 포인트 나 ㄹ 먹 하 겠 다,,,,,,,,,,,,,,
원리 위주 로 설명 해주시 니까 강의 노트 그대로 설명 하 아 주 기 ㄹ 원 하 시 는 분 은 비추,,,,,,,,,,,,,,
중간 중간 학문 에 대하 ㄴ 흥미 를 위하 아 전자기 학 이론 과 관련 되 ㄴ 물리 현상 도 말씀 하 아 주 시 는 이런 교수 님 이 전기 과 교수 님 이 라는 것 이 자랑 스럽 습니다,,,,,,,,,,,,,,
장점 이 라면 인기 가 없 어서 재수강 생 들 이나 성적 안 좋 은 학생 들 이 많이 수 강하 아서 상대 평가 에 이득 봄,,,,,,,,,,,,,,
얻 어 가 는 것 1 도 없 고 딱 1 학년 과목 에 어울림 많이 치 어 주 어도 2 학년 1 학기,,,,,,,,,,,,,,
실습 수업 은 파이 썰 ㄴ OPENCV 로 진행 되 는데 얻 어 가 는 것 이 하나 도 없 는 것 같 습니다,,,,,,,,,,,,,,
그렇지만 머리 에 주로 남 는 내용 은 예시 들,,,,,,,,,,,,,,
가끔 씩 사례 에 대하 ㄴ 내용 이 문제 로 나오 는 것 같 은 데 그냥 무슨 내용 이 ㄴ지 정도 말 ㄴ 알 고 계시 면 되 고 이론 을 중심 으로 정리 하 시 기 ㄹ 바라 ㅂ니다,,,,,,,,,,,,,,
조원 들 과 내용 을 이해 하고 상의 하 는 데 도 굉장히 어렵 었 습니다,,,,,,,,,,,,,,
그냥 흘러가 는 과목 .. 실질적 이 ㄴ 도움 이 없 음,,,,,,,,,,,,,,
네트워크 에 대하 ㄴ 전반적 이 ㄴ 내용 을 배우 ㄹ 수 있 어서 좋 았 습니다,,,,,,,,,,,,,,
공부 많이 하 는 대로 성적 잘 나오 는 듯,,,,,,,,,,,,,,
상대 평가 이 다,,,,,,,,,,,,,,
고학 벌 ㄴ 많 고 사람 수 적 으면 학점 잘 받 기 힘들 수 있 습니다,,,,,,,,,,,,,,
공부 하 ㄹ 양이 엄청 많 은데 넓 고 깊 다,,,,,,,,,,,,,,
열심히 들 으면 성적 도 잘 나오 ㄴ다,,,,,,,,,,,,,,
대신 진도 가 빠르 니까 그만큼 많 은 양 을 얻 어 가 ㄹ 수 있 는 거라고 생각하 ㄴ 다,,,,,,,,,,,,,,
고통 뿐 이 었 음,,,,,,,,,,,,,,
네트워크 를 잘 알 시 는 만큼 즐겁 게 강의 하 시 는 교수 님 의 모습 을 보 았 다,,,,,,,,,,,,,,
시험 은 단답 형 + 객관식 으로 나오 는데 수업 내용 열심히 외우 면 되 ㅁ,,,,,,,,,,,,,,
"""결과 도 중요 하 지만 과 정 즉 "," 배우 ㅁ""",,,,,,,,,,,,,,
그런데 수업 외적 으로 이런저런 얘기 가끔 해주시 는데 그것 이 오히려 도움 이 되 었 음,,,,,,,,,,,,,,
조 모임 이 많 고 부담 이 많이 되 었 다,,,,,,,,,,,,,,
"""팀 프로젝트 은 팀 잘 걸리 는 것 이 중요 하 니 "," 시험 에 대하 ㄴ 얘기 만 하 겠 음""",,,,,,,,,,,,,,
수업 은 매우 깔끔 하고 도움 이 많이 되 는 수업 수업 열심히 듣 고 공부 열심히 하 면 성적 은 잘 나오 ㄴ다,,,,,,,,,,,,,,
배우 는 것 많 은데 ... 교수 님 엄청 똑똑 하 시 고 전문적 이 어서 확실히 배우 고 얻 어 가 는 것 많 다는 느낌 받 았 어요,,,,,,,,,,,,,,
다만 팀 프로젝트 이 많 고 발표 를 하 아야 하 는 것 이 흠 이 길 ㄴ 한데 어차피 전공 기초 니까 열심히 배우 ㄴ 다 생각 하고 들 으면 얻 어 가 는 것 은 많 아서 좋 아요,,,,,,,,,,,,,,
"""교수 님 강의 는 그냥 이론 "," 용어 읽 어 주 시 는 정도""",,,,,,,,,,,,,,
학생 평가 는 장단점 이 있 는데 수강 생 들 의 성격 에 따르 아 평가 기준 의 호불호 가 상당히 갈리 ㄴ다,,,,,,,,,,,,,,
강의 내용 은 괜찮 으나 교수 님 말투 가 좀 딱딱,,,,,,,,,,,,,,
그리고 조 별 발표 로 강의 의 한 파트 를 맡 아서 수업 을 진행 하 아야 되 는데 그냥 조원 잘 만나 야 되 ㅁ,,,,,,,,,,,,,,
보 면 A 저 의 로 는 맞 을 수 있 음,,,,,,,,,,,,,,
교재 가 있 는 것 도 아니 고 오 았 다,,,,,,,,,,,,,,
배우 ㄹ 것 은 매우 많 고 강의 력 도 훌륭 하 시 ㅂ니다,,,,,,,,,,,,,,
남 들 다 종강 하 ㄹ 때 우리 ㄴ 플젝  힘들 었 지만 그 에 대하 ㄴ 보답 을 해주시 는 것 같 다,,,,,,,,,,,,,,
#NAME?,,,,,,,,,,,,,,
생각 하 지만 이 수업 을 듣기 싫 다는 생각 은 안 들 ㅁ,,,,,,,,,,,,,,
교수 님 만 의 수업 방식 이 있 는데 적응 못하 면 수업 이 난감 하 ㅁ,,,,,,,,,,,,,,
수업 쉽 고 알차 고 많 은 말 해주시 려고 하 ㅂ니다,,,,,,,,,,,,,,
그렇지만 수업 내용 잘 이해 하 려 하 고 스스로 인터넷 등 등 찾아가 면서 공부 하 면 그렇게 어렵 지 도 않 을 것 이 ㅁ,,,,,,,,,,,,,,
중간 40 + 기말 60 혹은 기말 100 이 ㄴ데 기 말 가 전 범위 이 기 때문 에 기말 만 잘 보 는 것 은 힘들 것 같 다,,,,,,,,,,,,,,
교수 님 자체 는 츤데  나 는 귀엽 다구 생각하 았 음,,,,,,,,,,,,,,
강의 능력 을 모르 겠 다 기 보 단 본인 의지 에 따르 아 빠지 어 들 는 수업 ...,,,,,,,,,,,,,,
그리고 목소리 가 원래 작 으 신지 마이크 가 안 좋 은지 뒤쪽 에 앉 으면 목소리 가 알 ㄴ 들리 ㅁ,,,,,,,,,,,,,,
"""물론 두 번의 크 ㄴ 레포트 산과 미치 ㄴ 시험 범위 의 기 말 가 기다리 고 있 지만 "," 금융 에 흥미 가 있 고 평소 학점 관리 에 관심 이 많 은 학생 이 라면 꼭 한번 들 어 보 기 를 바라 ㄴ다""",,,,,,,,,,,,,,
화공 과 학생 들 은 교수 님 수업 열의 다 들 인정 하 ㄹ 듯 하 ㅂ니다,,,,,,,,,,,,,,
좋아하 는 과목 이 ㄴ 만큼 관심 들이 어서 그렇 ㄴ지 점수 는 잘 나오 는 듯 ... 물론 내용 은 어렵 다,,,,,,,,,,,,,,
1 학년 때 아무것 도 모르 는 상태 에서 듣 어서 그때 ㄴ 조금 어려워하 기 도 하 고 힘들 었 는데 지금 생각 하 니 이지은 교수 님 만큼 1 학년 들 상황 고려 하 아 주 시 고 이해 하 기 쉽 게 설명 해주시 는 분 이 없 는 것 같 습니다,,,,,,,,,,,,,,
1 매우 유익 하 ㄴ 수업,,,,,,,,,,,,,,
시키 는 추가 숙제 많이 하 거나 성적 잘 받 으면 A + 넉넉 하 것 이 주 시 ㅂ니다,,,,,,,,,,,,,,
학점 취득 은 둘째 치고 과목 에 대하 ㄴ 이 해도 를 확 높히 어 주 시 기 때문 에 나중 에 배우 것 이 되 는 과목 으로 들어가 ㄹ 때 도움 이 되 ㄹ 것 으로 보이 ㅁ,,,,,,,,,,,,,,
"""강의 에 대하 ㄴ 준비 도 열심히 하 아 오 시 고 "," 이런 분 이 교수 라는 직업 에 완벽히 들 어 맞 는다고 생각 하 ㅁ""",,,,,,,,,,,,,,
수업 시간 에 집중 하 아서 최대한 이해 하고 숙제 만 성실 하 게 하 면 충분히 좋 은 성적 얻 을 수 있 습니다,,,,,,,,,,,,,,
기말 랑 출 결 이 빡 세 기 는 하지만 교수 님 께서 실제 취업 관련 되 ㄴ 말씀 도 많이 해주시 고 도움 을 주 시 려고 하 ㅁ,,,,,,,,,,,,,,
그 이후 로 기존 디스플레이 와 쌩 팔 ㄴ 다른 내용 만 배우 ㄴ다,,,,,,,,,,,,,,
도움 1 도 안 되 ㄹ 뿐 더러 학점 은 매우 짜 다,,,,,,,,,,,,,,
디스플레이 취업 하 는 사람 들 도 사실 보상 회로 외 에 는 크 ㄴ 도움 도 안 되 는 과목 이 ㄴ 것 같 다,,,,,,,,,,,,,,
반도체 디스플레이 공학 에서 는 힘들 어도 내용 은 좋 았 는데 이번 수업 내용 은 별로 도움 이 안 되 네요,,,,,,,,,,,,,,
진짜 하 ㄴ 문 싫어하 는 사람 이 라도 김성훈 교수 님 높 은 강의 력 과 생각 보다 꿀 교양 이 ㅁ,,,,,,,,,,,,,,
보 면 언젠가 는 도움 이 되 ㄹ 유익 하 ㄴ 교양 수업 이 ㅂ니다,,,,,,,,,,,,,,
아주 유익 하고 남 는 것 이 있 는 수업,,,,,,,,,,,,,,
목소리 가 약간 작 으시 ㅁ,,,,,,,,,,,,,,
근데 교수 님 목소리 가 작 으시 어서 뒤 에 앉 아 있 으면 잘 알 ㄴ 들리 고 졸리 ㄹ 수 있 어요,,,,,,,,,,,,,,
"""본인 이 암기 하 는 것 에 달리 었 고 "," 수업 은 내용 이 워낙 지루하 기 ㄴ 하지만 교수 님 이 맹자 와 수업 을 아끼 시 는 것 이 보이 어서 이 좋 습니다""",,,,,,,,,,,,,,
이 수업 은 ' 한자 ' 를 배우 는 수업 이 아니 라 한자 로 되 ㄴ 문장 을 배우 는 ' 한문 ' 수업 이 시 ㄴ 것 감안 하 시 고 가 면 하 ㄴ 문 을 잘 해석 하 어 주 시 ㄴ다는 것 을 깨닫 게 되 ㅂ니다,,,,,,,,,,,,,,
과 훈 정도 만 꾸준히 숙지 하 면 시험 기간 에 그렇게 많이 외우 ㄹ 양은 아니 ㄴ 것 같 음,,,,,,,,,,,,,,
얻 어 가 는 것 도 많 고 쉽 게 배우 ㄹ 수 있 습니다,,,,,,,,,,,,,,
' 교양 ' 과목 에 어울리 는 수업 이 었 던 것 같 다,,,,,,,,,,,,,,
"""엄마 같 아 ", 아니 ㄴ 것 같 은 데 시험 안 어렵 게 조절 하 아 주 시 고 , 범위 다 알리 어 주 고 ," 수업 도 진짜 인생 에 도움 되 는 얘기 많이 해주시 고 1 학기 수업 중 에 나 가 정 제일 많이 가 았 던 교양 이 ㅁ""",,,,,,,,,,,,,,
중간 기말 총합 1000 자 정도 는 되 ㄴ 듯 A + 받 았 구 시험 은 진짜 수업 듣 은 것 필기 열심히 하 고 달달달 달 외우 면 되 ㅁ,,,,,,,,,,,,,,
교수 님 께서 열정 으로 가르치 시 고 재미있 고 유익 하 ㄴ 들 ㄹ 유래 도 알리 어 주 시 어서 수업 은 재미있 습니다,,,,,,,,,,,,,,
교양과목 이 ㄴ 특성 으로 깔 아 주 는 애 들 이 많 아서 수월 하 았 음,,,,,,,,,,,,,,
교수 님 이 수업 시간 에 하 ㄴ 문 단어 나 사자 성어 에 담기 ㄴ 고전 이야기 해주시 고 그러 는데 개인적 으로 는 흥미 로웠 음,,,,,,,,,,,,,,
그래도 그런 얘기 가 시험 에 나오 는 것 은 아니 라 그냥 수업 시간 에 하 ㄴ 귀로 듣 고 하 ㄴ 귀로 흘리 면서 하 ㄴ 문 쓰 면서 외우 는 것 이 이득 이 ㄹ 듯,,,,,,,,,,,,,,
공부 하 ㄹ 내용 도 많 고 무엇 보다 수강 생 들 실력 이 상당 하 ㅂ니다,,,,,,,,,,,,,,
열심히 하 ㄹ 각오 되 어 있 는 분 들 만 듣 으시 기 ㄹ 바라 ㅂ니다,,,,,,,,,,,,,,
한 자 에 관련 되 ㄴ 다양 하 ㄴ 지식 을 익 힐 수 있 어서 좋 았 습니다,,,,,,,,,,,,,,
"""다만 "," 시간 투자 를 많이 하 아야 되 는 것 은 아니 니 부담 가지 지 않 으시 어도 되 ㅂ니다""",,,,,,,,,,,,,,
한 문 하나 도 모르 면 시험 때 는 노력 많이 하 아야 하지만 그만큼 잘 배우 었 습니다,,,,,,,,,,,,,,
능력자 들 많 다는 것 명심 하 시 어요,,,,,,,,,,,,,,
솔직히 저 한테 ㄴ 많이 쉽 었 고 저 가 생각하 았 던 시험 난이도 에 비하 아 잘 보 ㄴ 사람 이 별로 없 었 던 것 같 아요,,,,,,,,,,,,,,
근데 지나 ㄴ 학기 에 중국인 들 이 많이 듣 어서 많이 시 끄 러웠 음,,,,,,,,,,,,,,
"""수업 자체 를 잘 못하 시 고 ", 기 초 한문 들 으러 오 았 는데 자격증 따르 아 는 둥 ," 시 사적 이 ㄴ 얘기 도 많이 하 시 ㅁ""",,,,,,,,,,,,,,
믿 보하 조 믿 고 보 는 하 지 환조 교 님 이 라고 하 는 뜻,,,,,,,,,,,,,,
실험 보고서 는 조교 마다 원하 는 스타일 이 다르 ㄹ 수 있 음,,,,,,,,,,,,,,
이것 으로 얻 어 가 ㄹ 것 은 없 고 잘못 되 ㄴ 내용 도 다수인 데 학점 따 기 는 쉽 ㅁ,,,,,,,,,,,,,,
교재 가 따로 없 고 자료 가 매우 많 아서 공부 하 ㄹ 때 혼란 스럽 지만 노력 하 ㄴ 만큼 나오 기 때문 에 열심히 하 면 좋 은 결과 를 얻 을 수 있 는 것 같 아요,,,,,,,,,,,,,,
수업 시간 에 슬쩍 다른 교수 님 들 뒷담 까 고 하 시 던데 이번 학기 는 본인 이 제일 욕 많이 먹 은 것 을 아 시 ㄹ까요,,,,,,,,,,,,,,
팀 프로젝트 조원 잘 만나 시 기 ㄹ ... 열심히 하 는 사람 들 만나 면 편하 게 잘 가 ㄹ 수 잇 어요,,,,,,,,,,,,,,
첫 번 째 보다 ㄴ 두 번 째 가 더 시간 이 많이 들 기 는 하 아요,,,,,,,,,,,,,,
교수 님 수업 은 괜찮 은데 PPT 암기 량 이 많 음,,,,,,,,,,,,,,
두 번 째 팀 프로젝트 이 진짜 시간 투자 를 많이 하 아야 되 는 숙제 이 었 음,,,,,,,,,,,,,,
숙제 량 이 많 기 는 하나 수업 중 에 배우 ㄴ 것 을 잘 적용 시키 ㄴ다면 좋 은 점수 받 을 수 있 습니다,,,,,,,,,,,,,,
팀 프로젝트 3 번 에 중간 기말 시험 이 있 어서 힘들 었 지만 많이 배우 ㄹ 수 있 음,,,,,,,,,,,,,,
교수 님 좋 으시 고 수업 시간 에 조금 이 라도 도움 이 되 ㄹ 수 있 는 것 을 가르치 려고 애쓰 시 어요,,,,,,,,,,,,,,
"""전 개인적 으로 그것 이 좋 았 고 배우 ㄴ 것 이 많 았 는데 "," 필기 하 는 그것 좋아하 고 딱딱 떨어지 는 수업 좋아하 시 는 분 들 한테 는 힘들 수도 있 습니다""",,,,,,,,,,,,,,
실험 도 재미있 고 후 에 배우 ㄹ 내용 관하 아서 도 어느 정도 지식 습득 에 도움 이 되 ㅂ니다,,,,,,,,,,,,,,
시험 으로 판가름 안 남,,,,,,,,,,,,,,
시험 문제 는 코딩 보다 는 원리 에 대하 어 많이 나오 아서 수업 잘 듣 은 것 이 도움 이 되 ㄴ 것 같 아요,,,,,,,,,,,,,,
교수 님 이 잘 알리 어 주 시 는 편 이 니 수업 열심히 들 으면 도움 이 되 ㄹ 것 이 다,,,,,,,,,,,,,,
그리고 교수 님 약간 츤  레 이 ㅁ,,,,,,,,,,,,,,
학생 들 에 대하 ㄴ 애정 이 상당히 깊 으시 다,,,,,,,,,,,,,,
필기 와 수업 보다 는 책 을 파 시 어야 하 ㅁ,,,,,,,,,,,,,,
명성대 시험 은 난이도 가 꽤 있 는 편 이 나 제대로 공부 를 하 고 싶 다면 추천 하 는 강의,,,,,,,,,,,,,,
나름 듣 을 만 하 고 학점 은 + 로 채우 어 주 시 ㄴ 듯 하 ㅂ니다,,,,,,,,,,,,,,
"""1 "," 3 번 은 쉽 었 고 2 번 은 좀 생각하 아 야 하 ㄹ 부분 이 많 았 지만 완성 은 하 았 음""",,,,,,,,,,,,,,
온라인 강의 이 ㄴ데 온라인 강의 에서 하 는 발음 이 개 오바 이 었 음,,,,,,,,,,,,,,
내용 이 상당히 많 지만 시험 공부 는 데이터베이스 응용 1 처럼 하 시 면 되 ㅂ니다,,,,,,,,,,,,,,
대부분 의 학우 들 이 점수 를 받 으므로 놓치 시 면 좋 은 학점 을 얻 기 는 힘들 시 ㄹ 것 이 ㅂ니다,,,,,,,,,,,,,,
아쉽 ㄴ 점 이 있 다면 PPT 를 강의 자료 로 올리 어 주 시 지 않 아서 책 을 사 야 하 ㄴ다는 점 ... 선배 에게 물려받 는 것 추천 드리 어요,,,,,,,,,,,,,,
다른 교수 님 들 은 빨리 수업 하 아서 집중 하 ㄹ 수 있 는데 천천히 수업 하 시 어서 집중 이 잘 안 되 ㅁ,,,,,,,,,,,,,,
괜찮 고 교수 님 도 친절 하 ㄴ데 통계 쪽 에 관심 있 으시 ㄴ 분 들 께 추천 마케팅 분야 는 비추,,,,,,,,,,,,,,
그냥 마케팅 이랑 은 좀 다르 아서 당황 하 았 네요,,,,,,,,,,,,,,
SPSS 통계 프로그램 을 배우 ㅁ,,,,,,,,,,,,,,
그래도 관련 부서 취업 준비 하 ㄹ 때 도움 이 되 었 음,,,,,,,,,,,,,,
온라인 수업 이였 음,,,,,,,,,,,,,,
키워드 이용 하 아서 서술 형 으로 쓰 는 방식 으로 공부 하 면 도움 많이 됩니 ,,,,,,,,,,,,,,
학생 들 이 이해하 ㄹ 수 있 게 굉장히 수업 을 꼼꼼 하고 잘 가르치 시 ㄴ다,,,,,,,,,,,,,,
수업 은 좋 은데 내용 이 쉽 다,,,,,,,,,,,,,,
"""강의 평이 안 좋 아서 걱정 되 기 ㄴ 하 았었 는데 "," 막상 들 어 보 니 괜찮 았 다""",,,,,,,,,,,,,,
강의 력 이 좋 으시 ㄴ 편 은 아니 지만 수업 말 ㄴ 집중 하 아서 들 으면 나름 괜찮 다,,,,,,,,,,,,,,
강의 력 과 시험 수준 학점 까지 삼 위 일체 최악 의 집합체,,,,,,,,,,,,,,
나 가 지금 까지 듣 은 수업 중 에 진짜 도움 안 되 는 수업 TOP 3 안 에 듬,,,,,,,,,,,,,,
앞 으로 배우 ㄹ 커리큘럼 에 대하 아서 도 설명 을 잘 하 아 주 시 ㅁ,,,,,,,,,,,,,,
수업 은 프린트 물 로 진행 되 는데 은근히 양이 많 고 내용 이 휘발 성 이 강하 아서 외우 기 힘들 음,,,,,,,,,,,,,,
생활 스페인어 라 걱정 많이 하 았 는데 생각 보다 유익 하고 재미있 었 다,,,,,,,,,,,,,,
다만 기초 스페인어 수업 자리 를 얻 으시 었 다면 그쪽 으로 가 시 는 것 이 더 좋 기 는 하 ㄹ 것 이 ㅂ니다,,,,,,,,,,,,,,
"""정치 ", 경제 ," 사회 등 주요 분야 를 통 시 적 으로 배우 는 만큼 흐름 을 중시 하 며 암기 하 는 것 이 포인트""",,,,,,,,,,,,,,
실무 나 취업 관련 이야기 및 상담 도 원하 시 면 다 해주시 니 적극적 으로 수업 에 참여 하고 교수 님 이 질문 하 는 것 을 굉장히 중요 하 게 생각 하 시 니 열심히 하 면 분명 얻 어 가 는 것 이 많 은 수업 이 다,,,,,,,,,,,,,,
수업 관련 되 ㄴ 재무 관리 내용 한 번 씩 읽 어 보 고 유인물 과 필기 내용 공부 하 면 이 해 에 는 무리 없 을 듯 개인적 으로 배우 는 내용 이 좋 고 교수 님 이 좋 아 추천 하 ㅂ니다,,,,,,,,,,,,,,
강의 내용 외 에 개인적 이 ㄴ 이야기 많이 하 시 었 지만 부모 님 께 감사 드리 는 마음 같 은 좋 은 이야기 많이 하 아 주 시 어서 상관 없 었 다,,,,,,,,,,,,,,
직장 을 가지 고 계시 ㄴ 교수 님 이 라 실무 얘기 를 많이 듣 을 수 있 어서 좋 았 고 교수 님 이 인간적 으로 좋 으시 ㅂ니다,,,,,,,,,,,,,,
교수 님 방식 이 대학생 은 혼자 공부 하 ㄹ 수 잇 는 능력 이 있 어야 하 ㄴ다 여서 결석 많 아도 출 결 점수 는 같 음,,,,,,,,,,,,,,
수업 은 책 을 그대로 짚 어 주 는 식 이 어서 그렇게 열심히 알 ㄴ 들 었 지만 혼자 공부 하 아도 충분 하 았 고 교수 님 이 좋 으시 ㄴ 분 이 었 음,,,,,,,,,,,,,,
전자공학 하 면서 신호 처리 에 대하 어 솔직히 배우 었 다는 생각 은 이번 이 처음 이 다,,,,,,,,,,,,,,
그리고 시험 도 원리 위주 여서 평소 에 공부 하 았 다 면 굳이 시험 공부 많이 오랫동안 안 하 아 도 잘 풀 수 있 음,,,,,,,,,,,,,,
자기 하 기 나름 하 아야 하 는 것 은 많 지만 이 만큼 학생 생각하 아 주 는 교수 님 찾 기 힘들 지 않 을까 싶 어요,,,,,,,,,,,,,,
수업 도 잘 설명 해주시 고 최고,,,,,,,,,,,,,,
"""교수 님 께서 학생 들 입장 에서 생각하 아 주 시 고 "," 좋 은 언어 로 피드백 해주시 는 모습 이 좋 았 습니다""",,,,,,,,,,,,,,
"""특히 수학 의 기초 "," 증명 위주 수업 이 라 남 는 것 이 많 음""",,,,,,,,,,,,,,
............ 대신 얻 는 것 은 없 음,,,,,,,,,,,,,,
결국 잘 나오 려면 시험 을 잘 보 아야 하 는데 꼼꼼 하 게 하나하나 씩 채점 하 시 어서 생각 보다 점수 얻 기 는 힘 들 ㅁ,,,,,,,,,,,,,,
"""행렬 ", 최적화 문제 ," 미분 등등 배우 ㅂ니다""",,,,,,,,,,,,,,
진짜 교수 님 이 나 보고 직접 전화 로 지금 부터 이 라도 수업 나오 아서 시험 치 면 F 는 알 ㄴ 줄 거라고 말씀 하 시 어서 기말 60 점 받 았 는데 그냥 F 주심 성적 나오 자마자 어이 가 없 고 머리 가 멍 해지 더라 내년 에 ㄴ 이 산수 학 하 시 는데 수업 듣 어야 하 나 고민 까지 하 게 말 ㄴ 심 저 의 발 다른 교수 님 으로 바꿔주 셨 으면,,,,,,,,,,,,,,
저 에게 ㄴ 인생 교수 님 이 었 습니다,,,,,,,,,,,,,,
교수 님 께 불만 을 갖 기 전 에 먼저 본인 을 되돌아보 는 것 이 좋 을 듯 하 ㅂ니다,,,,,,,,,,,,,,
나름 도움 되 는 내용 도 많 았 고 그냥 노력 과 결과 가 비례 하 는 듣기 좋 은 교양 이 었 다,,,,,,,,,,,,,,
그래도 배우 는 내용 이 유익 하 ㅁ,,,,,,,,,,,,,,
인생 에 대하 어 생각하 아 보 ㄹ 수 있 어서 유익 하 았 다,,,,,,,,,,,,,,
알차 서 전혀 관심 없 던 중국 사회 문화 제대로 배우 ㄹ 수 있 었 습니다,,,,,,,,,,,,,,
책 은 필요 없 고 수업 에 배우 ㄴ 내용 필기 만 꼼꼼이 하 면 시험 은 배우 ㄴ 내용 바탕 으로 자기 생각 쓰 는 것 라서 성적 잘 주 시 어요,,,,,,,,,,,,,,
받 았 다 하 더라도 세상 에 ㄴ 여러 의견 이 존재 하 ㄴ다,,,,,,,,,,,,,,
정치색 엄청 짙 으시 고 수업 내용 의 40 프로 가 현 정권 비판 이 고 세월호 얘기 하 시 고 수업 도 엄청 지루 하 ㄴ데 교수 님 이 중국 뿐 만 아니 라 다른 분야 에서 도 지식 이 많 으시 고 이것저것 얘기 많이 하 어 주 심,,,,,,,,,,,,,,
중국 에 대하 아서 알 는 지식 이 거의 없 어서 듣 게 되 었 는데 솔직히 수업 시간 에 많이 힘들 었 어요,,,,,,,,,,,,,,
기 말 은 논술식 이 었 는데 평가 기준 이 무엇 이 었 는지 도 모르 겠 음,,,,,,,,,,,,,,
"""학생 들 에 대하 ㄴ 애정 과 관심 이 아주 높 으시 어서 강의 준비 는 잘 하 아 오심 "," 사실 빡 세 ㄴ 과목 이 었 는데 하 는 만큼 받 아 가 는 얻 어 가 는 뜻 깊 은 수업 이 었 음""",,,,,,,,,,,,,,
수업 열심히 들 으면 교수 님 이 복습 도 많이 하 시 어서 따라가 기 쉽 습니다,,,,,,,,,,,,,,
"""회계사 "," 세무사 수험 생 이 많이 수강 하 는 과목 이 ㅂ니다""",,,,,,,,,,,,,,
그런데 수업 막판 에 교수 님 이 하 시 ㄴ 말 ' 기말 은 출석부 를 옆 에 두 고 채점 하 겠 습니다,,,,,,,,,,,,,,
그러 다 보 니 교육적 이 ㄴ 측면 에서 는 배우 려는 사람 에게 는 많이 지루 하 ㄴ 편 이 고 그렇게 뜻 깊 게 배우 었 다는 의미 는 들 지 않 음,,,,,,,,,,,,,,
심리학 이나 상담학 에 흥미 가 있 다면 좋 은 수업 이나 ... 관심 1 도 없 다면 아주 지루 하 ㄴ 수업 ..,,,,,,,,,,,,,,
수업 을 이해 시키 어 주 시 려고 최선 을 다 해주시 는 것 같 아 요 그냥 수업 때 마다 열심히 들 어 놓 으면 학점 은 그만큼 따라오 는 것 같 아요,,,,,,,,,,,,,,
목소리 가 호불호 좀 갈리 ㄹ 수 있 지만 강의 력 이 압도 하 ㅂ니다,,,,,,,,,,,,,,
"""이론 중간 "," 기말 그리고 실험 시험 까지 총 3 번 의 시험 을 봄""",,,,,,,,,,,,,,
