....... 많이 배워가 여 ...,,,,,,,,,,,,,,
다음 에 도 수업 에서 또 뵙 고 싶 어 여 부담 없이 편안 하고 토론 시간 이 기대 되 는 그런 수업 이 었 어요,,,,,,,,,,,,,,
내용 도 수사학 을 전공 하 시 어서 말 을 깔끔 하 게 하 ㄹ 수 있 는 방법 을 잘 가르치 어 주 시 는 것 같 습 ㅂ니다,,,,,,,,,,,,,,
이런 것 은 없 었 습니다,,,,,,,,,,,,,,
말 도 잘 하 시 고 나 가 생각하 ㄴ 가장 이상적 이 ㄴ 대학 강의,,,,,,,,,,,,,,
다른 토 커 는 숙제 가 진짜 많 다고 듣 었 는데 이 교수 님 은 각자 토론 준비 말 고 는 따로 준비 하 는 것 없이 가 벼 울 ㄴ 마음 으로 듣 고 의 견 나누 는 식 으로 수업 하 시 ㅁ,,,,,,,,,,,,,,
이런 것 불편 하 시 다면 안 듣 는 것 이 좋 을 듯,,,,,,,,,,,,,,
토론 을 준비 하고 토론 하 는 모습 을 보 고 하 는 것 고 시험 은 별로 중요 하 지 않 습니다,,,,,,,,,,,,,,
수업 참여 도 점수 가 중요 하 ㄴ 것 같 아요,,,,,,,,,,,,,,
다른 토 커 는 자 ㄹ 모르 겠 지만 이 토 커 는 확실히 하 ㄹ 것 이 없 습니다,,,,,,,,,,,,,,
토론 한 번 만 준비 하 아 가 시 면 하 ㄹ 것 없 습니다,,,,,,,,,,,,,,
대신 배우 는 것 도 별로 없 는 것 같 습니다,,,,,,,,,,,,,,
#NAME?,,,,,,,,,,,,,,
... 점수 를 어떻하 게 주 는지 아무 도 모르 ㅁ,,,,,,,,,,,,,,
"""토론 대회 준비 "," 얘기 하 시 느라 수업 준비 를 잘 안 하 시 고 수업 도 쫓기 어서 하 ㅁ""",,,,,,,,,,,,,,
이 것 이 토론 대회 를 위하 ㄴ 수업 이 ㄴ지 토론 자체 를 위하 ㄴ 수업 이 ㄴ지 를 모르 겠 음,,,,,,,,,,,,,,
더 좋 은 수업 이 없 음,,,,,,,,,,,,,,
땀 을 펄펄 쏟 아내 시 ㄹ 정도 로 가르치 어 주 시 고 싶 은 것 도 많 고 하 시 고 자 하 는 바 도 많 은데 무엇 ㄴ가 뒷심 이 받치 어 주 지 않 는 느낌,,,,,,,,,,,,,,
배우 ㄹ 것 이 많 은 것 보다 ㄴ 학점 을 잘 받 을 수 있 는 과목,,,,,,,,,,,,,,
산만 하고 핸드폰 하고 수업 집중 안 하 아 서 되게 짜증 나 았 음,,,,,,,,,,,,,,
계속 중국인 학생 들 통 역시 켜 고 재미있 어 하 시 는데 수업 수준 도 떨어지 고 짜증 남 .. 호기심 에 그러 시 는 것 이 ㄴ지 자제 를 못하 시 는 듯 관심 도 없 는 중국인 학생 들  되 어서 다 외우 게 생김,,,,,,,,,,,,,,
그냥 하 는 소리 아니 고 진짜 안 나오 ㅁ,,,,,,,,,,,,,,
교수 님 이 알 시 는 것 이 많 은 것 은 좋 으나 학생 들 에게 기회 를 주 는 척,,,,,,,,,,,,,,
저 도 눈치 보 다가 다 참여 하고 열심히 참여 하 았 으나 쓸데 없 는 가산점 을 이리저리 주 시 며 결국 에 재수 강 학점 이 ㅂ니다,,,,,,,,,,,,,,
듣 을 것 이 없 어도 듣 으시 면 안 되 는 과목 이 ㅂ니다,,,,,,,,,,,,,,
전공 보다 자기 교양 을 우선시 하 라는 마인드 로 학생 들 밤새 남기 고 휴일 이 든 평일 이 든 전화 까지 하 아서 괴롭히 는 말 도 안 되 는 수업 이 ㅂ니다,,,,,,,,,,,,,,
같이 토 크 어 듣 던 분 들 중 에 꿀 수업 같 은 댕 댕 이 소리 하 는 싸 패 가 숨 어 있 었 네요,,,,,,,,,,,,,,
"""수업 다 들 어 본 졸업반 분 들 "," 공대 분 들 이 인정 하 ㄴ 숭 대 최고 빡 세 ㄴ 수업 이 니까 약 팔지 말 시 기 ㄹ""",,,,,,,,,,,,,,
일요일 학생 가족 행사 로 불참 적 어 두 면 또 전화 와 서 어 전 공 수업 이 었 으면 너 는 행사 빼 고 수업 들 으러 가 았 을 끄 어 면서 왜 학교 와 서 어 토론 준비 안 하 냐,,,,,,,,,,,,,,
"""근데 그것 이 학문 을 위하 ㄴ 수단 이 어야지 "," 그냥 학교 에 붙 어 있 어서 ' 열성적 이 ㄴ ' 교수 님 눈 밖 에 나 지 않 는 것 이 목적 이 되 어 버리 ㅁ""",,,,,,,,,,,,,,
처음 3 분 스피치 에서 만 조금 힘들 고 끝나 면 숙제 도 A 4 한 장 글 써 오 기 고 완전 편하 게 학점 잘 챙기 어 가 ㅂ니다,,,,,,,,,,,,,,
처음 몇 주 동안 은 부담 스럽 겠 지만 3 분 스피치 시간 만 지나 면 이후 에 ㄴ 꿀 수업 이 에요,,,,,,,,,,,,,,
시키 는 것 도 많 지만 자기 하 는 것 에 따르 아 남 는 것 이 많 다고 생각 하 구요,,,,,,,,,,,,,,
토론 과 커뮤니케이션 에 대하 어 가르치 는 수업 이 지만 정작 커뮤니케이션 이 되 지 않 는,,,,,,,,,,,,,,
"""뭐 다 들 어렵 네 힘드 네 하지만 ", 3 학기 째 에 들 었 고 , 각종 교 내 동아리 학생회 알바 까지 같이 하 았 지만 ," 이런 수업 이 있 기 위하 아서 등록금 을 내 었 다는 생각 은 변하 지 않 는다""",,,,,,,,,,,,,,
"""한 학기 동안 배우 ㄴ 것 도 느끼 ㄴ 것 도 많 았 으며 "," 교수 님 의 열정 에 감사 하 ㅁ""",,,,,,,,,,,,,,
을 느끼 ㄴ다 나 가 학교 에 내 는 등록금 이 이런 수업 을 많이 만들 라고 하 는 것 같 다,,,,,,,,,,,,,,
"""과 연 대한민국 대학 중 "," 이렇게 까지 열정적 이 ㄴ 수업 이 있 을까""",,,,,,,,,,,,,,
숭실대 의 명물 수업,,,,,,,,,,,,,,
"""결론 은 발표 에 자신 이 없 거나 "," 토론 같 은 것 관심 없 으시 면 하 지 말 아라 하 아""",,,,,,,,,,,,,,
토론 에 대하 어 배우 ㄹ 것 은 많 아도 꿀 교양 은 아니 ㅁ,,,,,,,,,,,,,,
마지막 에 절 평이 라 하 아서 학생 들 다 좋아하 았 는데 원점수 로 절 평 이 ㅂ니다,,,,,,,,,,,,,,
사담 으로 수업 을 가득 채우 ㅁ,,,,,,,,,,,,,,
자기 가 진행 하 는 수업 이 절 평인 지 상 평인 지 도 모르 ㅁ,,,,,,,,,,,,,,
"""출석 은 하 는 것 이 당연 하 ㄴ 것 이 지 무슨 출 결 때문 에 뭐 라 뭐 라 ","""",,,,,,,,,,,,,,
아니 절 평인 데 왜 점수 를 이렇게 짜 게 주 는 지 모르 겠 음,,,,,,,,,,,,,,
저 번 학기 때 학점 느 님 이 라고 하 는 소리 믿 지 말 았 어야 하 았 음,,,,,,,,,,,,,,
2 수업 알 ㄴ 들 었 지만 수업 하 다가 딴 내용 으로 새 거나 본인 얘기 하 는 것 은 알 겠 더라구 요 그리고 정치색 드러내 는 그것 좋아하 는 것 같 고 ... 네 ...,,,,,,,,,,,,,,
5 성적 상 평 이리하 았 다가 다시 절 평 으로 바뀌 었 는데 엄청 짜 게 주 는 것 같 네요,,,,,,,,,,,,,,
집중 하 아서 잘 들 으면 무슨 말 이 ㄴ지 는 알 것 같 습니다,,,,,,,,,,,,,,
수업 듣 는 것 랑 공부 하 는 것 은 비교적 편하 았 지만 점수 가 너무 깐깐 하 아서 때문 에 별 하나 빼 ㄹ 게요,,,,,,,,,,,,,,
"""숙제 는 1 시간 컷 "," 이슈 에 관심 이 많 으면 시험 공부""",,,,,,,,,,,,,,
얘기 랑 무슨 전북대,,,,,,,,,,,,,,
이런 얘기 수업 시간 에 맨날 하 ㅁ,,,,,,,,,,,,,,
수업 이 지루 하고 갑자기 여 석 이 폭등 하 았 으며 기존 실 라 버스 와 는 다른 시험 방식 을 취하 아서 학생 들 불만 이 많 았 던 것 은 사실 이 지만 2 시간 도 공부 안 하 아서 A + 얻 어 가 ㄴ 희대 의 개 꾸 ㄹ 전공,,,,,,,,,,,,,,
전공 듣 을 것 도 없 고 학점 도 사 하 아 바닷물 처럼 짜 게 주 는 데 이번 학기 성 적 의 한 줄기 의 빛 이 되 어 주 ㅁ,,,,,,,,,,,,,,
200 명 강당 수업 이 ㄴ데 깊 은 배우 ㅁ,,,,,,,,,,,,,,
을 기대 하 지 는 말 고 국제적 이 ㄴ 상황 에 대하 ㄴ 상식 이나 흐름 을 배우 어 가 ㄴ다고 생각 하 면 편안 하 게 듣 을 수 있 는 강의 이 었 음,,,,,,,,,,,,,,
절대 이 수업 듣 나 보 아라 갑자기 여석 30 > 200 로 늘리 고 계획 없이 분 반하 고 뭐 제대로 알리 어 주 는 것 도 없이 통보 하고 자기 자랑 하고 출 결 신경 도 안 쓰 고 무책임 끝나 서 속 시원 하 다,,,,,,,,,,,,,,
그냥 가 아서 잘 것 면 수업 들 으면 속 터 지 ㅁ,,,,,,,,,,,,,,
이러 ㄹ 것 면 실험 과목 최소 2 학점 은 주 었스 면 하 ㅁ,,,,,,,,,,,,,,
화학 1 도 모르 고 듣 었 는데 그래도 나쁘 지 ㄴ 않 았 음,,,,,,,,,,,,,,
"""다른 학기 는 모르 겠 지만 "," 이 번 비 대면 학기 는 학점 느 님 이 ㄴ 것 같 습니다""",,,,,,,,,,,,,,
교수 님 최고 .. 전자 과 여서 1 학기 한 번 만 듣 는 것 이 아쉽 다고 생각,,,,,,,,,,,,,,
이 ㄴ 강 강사 보 는 줄  굳굳,,,,,,,,,,,,,,
"""고등학교 화학 1 "," 2 와 겹치 는 것 이 많 다""",,,,,,,,,,,,,,
밑 에 분 하 네 가르치 어 주 는 것 이 없 다니,,,,,,,,,,,,,,
가르치 어 주 는 것 없 음,,,,,,,,,,,,,,
근데 교수 님 착하 시 고 수업 빨리 끝내 주 어서 참 을 수 있 음,,,,,,,,,,,,,,
교재 에서 나오 지 도 않 는 편 미분 을 왜 가르치 시 어요,,,,,,,,,,,,,,
잘 가르치 시 면 뭐 라고 도 안 하 지 어후,,,,,,,,,,,,,,
따르 아 만 가 ㄴ다면 좋 은 수업 수업 을 처음 부터 집중 하 아서 듣 어야 학점 이 잘 나오 ㄹ 수업,,,,,,,,,,,,,,
다른 교수 님 수업 은 알 ㄴ 듣 어 보 아서 모르 겠 는데 노 베 기준 따라가 기 힘들 ㄴ 수업 이 ㄴ 듯 출 결 반영 안 하 고 기 출 나누 어 주 는 것 은 좋 았 음,,,,,,,,,,,,,,
덕분 에 의외로 잘 나오 기 도 하 았 고 근데 다음 에 ㄴ 다른 분 수업 듣 을 듯,,,,,,,,,,,,,,
그러나 교수 님 한테 찍히 는 것 같 고 고등학교 때 화학 수업 으로 전혀 듣 어 보 ㄴ 적 이 없 어서 굉장히 어렵 었 음,,,,,,,,,,,,,,
진짜 이것 이 대학 강의 구나 싶 음,,,,,,,,,,,,,,
유일하 수강 평 쓰 는 과목 숙제 가 많 고 어렵 ㄴ 편 하지만 로 대학 수업 을 듣 는다는 느낌 을 받 은 유일 하 ㄴ 과목 시험 도 숙제 와 유사 하 ㄴ 문제 로 출제 하 시 ㅂ니다,,,,,,,,,,,,,,
1 학년 수업 이 었 는데 학교 생활 에 적응 하 기 위하 ㄴ 여러 팁 이나 준비 하 아야 하 ㄹ 것 을 알리 어 주 시 는 것 이 좋 았 었 음,,,,,,,,,,,,,,
진짜 대학 강의 를 듣 는다는 느낌 을 받 았 습니다,,,,,,,,,,,,,,
근대 나 는 ....,,,,,,,,,,,,,,
시험 끝나 고 나 이 니까 기억 에 남 았 던 전공 이였 어요,,,,,,,,,,,,,,
배우 는 내용 이 추후 24 학년 때 도움 되 ㄹ 만 하 ㄴ 강의 들 로 가르치 어 주심,,,,,,,,,,,,,,
1 학년 수업 이 ㄴ데 MIT 영어 강의 로 가르치 시 는 것 은 좀 ...,,,,,,,,,,,,,,
수업 을 알 아들 을 수 가 없 음,,,,,,,,,,,,,,
수업 을 듣 는 것 이 손해란 말 이 나오 ㄹ 정도 로 수업 은 그냥 책 과 똑같이 말 하 시 고 수업 시간 의 절반 은 자신 의 철학 과 인생 얘기 이 ㅁ,,,,,,,,,,,,,,
그 대신 출 튀 하 아도 뭐 라고 안 하고 아예 대놓고 수업 안 듣 을 바 에 는 출 튀하 라고 하 았 음,,,,,,,,,,,,,,
하 ㄴ 것 이 지 수업 준비 를 하 시 는데 있 어서 잔 실수 가 많 으시 ㄴ 편 이 고 자기 가 뭘 하 고 있 느 닞  사실 모르 는 것 같 음,,,,,,,,,,,,,,
시험 문제 도 이 상하 고 자기 가 무슨 의 도로 내 었 는지 도 모르 는 것 같 음,,,,,,,,,,,,,,
아 물론 나 는 A + 받 기 는 하 았 는데 이것 은 뭐 수업 듣 는 학생 들 이 워낙 공부 를 안 하 아 서 그런 거라고 생각하 아 도 됌 이 과목 은 딱히 공부 를 안 하 아 도 점수 그냥 가져가 라 하 는 수업 이 ㄴ데 주위 사람 들 이 안 하 아 서 무엇 ㄴ가 하 ㄹ 얘기 는 많 은데 .. 1 점 이 ㄴ 것 보 았 으면 알 아서 거르 겠 지 뭐 그 정도 눈치 는 있 을 것 아니 겠 음,,,,,,,,,,,,,,
비율 알 ㄴ 채우 어 주 고 그냥 돈 학교 에 버리 러 가 아 다 생각 하셈,,,,,,,,,,,,,,
이후 에 출 튀하 고 남 아 있 는 인원 한 번 체크 하 았 는데 어떤 기준 으로 평가 는지 는 잘 모르 겠 음,,,,,,,,,,,,,,
수업 준비 도 많이 하 아 오 시 고 배우 는 것 이 많 은 수업,,,,,,,,,,,,,,
왜 이 ㄴ지 모르 겠 으나 조 별 숙제 에서 학생 들 이 굉장히 열심히 하 는 수업,,,,,,,,,,,,,,
이 수업 으로 얻 은 것 은 솔직히 크 게 없 습니다,,,,,,,,,,,,,,
이런 점 에서 는 ' 이 강의 꿀 이 다,,,,,,,,,,,,,,
' 라고 하 ㄹ 수 는 있 겠 지만 글쎄요 대학 강의 로서 얻 은 것 은 거의 없 습니다,,,,,,,,,,,,,,
교수 님 이 이 수업 재미없 을 끄 어 라고 드랍 하 어 도 되 ㄴ다고 하 시 ㄴ 이유 를 알 것 같 았 음,,,,,,,,,,,,,,
수업 배우 는 것 없 음,,,,,,,,,,,,,,
시험 배우 는 것 없 는데 시험 은 내야 하 니 진짜 이 상한 거만 나오 ㅁ,,,,,,,,,,,,,,
"""100 강의식 이 며 ", 숙제 도 없 고 ," 조 모임 도 없 습니다""",,,,,,,,,,,,,,
"""언제 보 ㄹ지 모르 는 "," 랜덤 퀴즈 3 번""",,,,,,,,,,,,,,
열심히 는 가르치 려고 하 시 는 것 같 지만 내용 자체 도 이것 ㄹ 굳이 수업 으로 듣 어야 하 는 내용 이 ㄴ 가하 아서 답답 2 배,,,,,,,,,,,,,,
교육자 대 제자 보다 는 사회 에서 선후배 로 만나 면 좋 을 것 같 은 느낌 우선 교재 위주 로 진도 나가 기 때문 에 교재 를 구입 하 거나 얻 는 것 이 좋 을 것 같 습니다,,,,,,,,,,,,,,
응 시험 문제 안 알리 어 주 어 무슨 70 프로 를 알리 어 주 어,,,,,,,,,,,,,,
이런 것 들 으려고 아침 에 학교 오 는 것 이 짜증 나 았 음,,,,,,,,,,,,,,
배우 ㅁ 보다 는 학점 이 먼저 이 시 ㄴ 분 들 께 추천,,,,,,,,,,,,,,
교수 님 이 열심히 가르치 려는 의욕 은 넘치 시 나 수업 의 가이드라인 을 확실히 잡 아 주 시 었 으면 하 았 습니다,,,,,,,,,,,,,,
방향 을 모르 겠 는 수업 이 ㅂ니다,,,,,,,,,,,,,,
최악 이 ㅁ 저 의 발 듣 지 말 아 요 진짜 .... 수업 에 체계 가 없 어서 이것 하 았 다 저거 하 았 다 정신 없 고 교수 님 자체 가 잘 모르 아서 설명 잘못 하 았 다 가 정정하 .... 편애 심하 ㅁ,,,,,,,,,,,,,,
수업 의 체계 가 잡히 어 있 지 않 은 느낌,,,,,,,,,,,,,,
수업 을 듣 고 나 면 오늘 강의 시간 에 뭘 하 았 는지 파악 이 잘 안 되 었 다,,,,,,,,,,,,,,
의식 의 흐름 으로 강의 가 흘러가 ㅁ,,,,,,,,,,,,,,
뭘 배우 었 는지 잘 모르 겠 음,,,,,,,,,,,,,,
모르 아요 로 웅성웅성 ,,,,,,,,,,,,,,
교수 꼰머  질 있 고 발표 는 개 짜증나 고 심지어 혼자 발표 하 게 되 면 사람 뒤 짐,,,,,,,,,,,,,,
전체적 이 ㄴ 정보 보안 에 대하 ㄴ 크 ㄴ 틀 을 배우 는 과목 이 라 정보 보안 에 대하 ㄴ 분위기 를 잡 는 데 는 좋 다고 생각 하 ㅂ니다,,,,,,,,,,,,,,
강의 에 대하 ㄴ 열정 이 많 으시 며 질문 하 면 잘 알리 어 주 시 ㅂ니다,,,,,,,,,,,,,,
나 의 주변 에 는 재수 강 하 아야 되 ㄹ 사람 많 아 보이 ㄴ다,,,,,,,,,,,,,,
강의 는 최고 그러나 나 의 학점 은 바삭바삭 하 아 지 ㅁ,,,,,,,,,,,,,,
재수강 하 라고 학점 아예 내리 어 주 시 ㄴ 것 같 은 데 재수강 안 하 고 그냥 가지 어 가 ㅂ니다,,,,,,,,,,,,,,
아쉽 ㄴ 점 은 신호 처리 에 는 표준 이 없 나 봄,,,,,,,,,,,,,,
가르치 는 것 은 괜찮 을지 모르 아도 진짜 시험 이나 평가 방식 이 개 쓰레기 니까 ㄴ,,,,,,,,,,,,,,
작년 임 교수 님 한테 신호 및 시스템 듣 고 올해 홍 교수 님 께 DSP 를 배우 었 는데 강의 수준 이 다르 았 어요,,,,,,,,,,,,,,
완전 힐링 되 는 느낌,,,,,,,,,,,,,,
신시 때 배우 ㄴ 내 영 다시 보 시 고 공식 같 은 것 은 다 외우 어 가 시 는 것 이 시험 나 ㄹ 멘탈 에 이롭 습니다,,,,,,,,,,,,,,
자기 가 뭘 가르치 는 지도 모르 는 양반 이 ㄴ데 뭘 건지 어 요,,,,,,,,,,,,,,
코로나 때문 에 온라인 으로 듣 어서 그렇 ㄴ지 모르 아도 나 는 나름 대로 괜찮 았 다,,,,,,,,,,,,,,
음 이번 에 코로 나라 잘 모르 겠 음,,,,,,,,,,,,,,
아니 왜 강의 력 이 좋 은 것 도 아니 고 친절 하 ㄴ 것 도 아니 ㄴ데 학점 은 왜 이렇게 비율 도 알 ㄴ 채우 어 주 ㅁ,,,,,,,,,,,,,,
수업 제대로 듣 은 것 이 하 ㄴ 번 도 안 되 네 여 맨날 웅얼거리 시 어서 마이크 가 무슨 기능 하 는 지 모르 겠 구 배우 는 것 랑 시험 문제 랑 딴판 이 어서 공부 하 는 보람 이 없 는 느낌 이 랄까 암튼 별로 이번 에 는 학점 도 알 ㄴ 채우 어 주 어서 더더욱 별로,,,,,,,,,,,,,,
휙휙 지나가 다가 이것 은 수업 때 한 것 다 라며 시험 문제 내 ㅁ,,,,,,,,,,,,,,
개씹 별 로 무슨 성적 확인 하 러 가 면 무조건 따지 는 줄 알 고 대화 다 잘라먹 고 가르치 는 것 도 없 으니까 그냥 대화 에서 이기 기 ,,,,,,,,,,,,,,
이런 교수 밖에 없 다는 것 이 어후,,,,,,,,,,,,,,
솔직히 이것 은 인정 하 ㄹ 것 이 ㅁ,,,,,,,,,,,,,,
.. 여러모로 지치 는 수업 .. 남 는 것 은 없 다,,,,,,,,,,,,,,
수업 내용 은 관련 전공 으로 진로 계획 중 이 면 괜찮 을 수 도 있 지만 시험 이랑 관계 없 는 내용 이 태반 이 며 의미 가 없 습니다,,,,,,,,,,,,,,
수업 이랑 시험 은 연관 이 거의 없 고,,,,,,,,,,,,,,
후회 하 기 싫 으면 절대 듣 지 말 으시 어요,,,,,,,,,,,,,,
수업 들 어도 남 는 것 이 하나 도 없 음,,,,,,,,,,,,,,
뭐 제대로 가르치 지 도 않 고 프로젝트 나 시키 고 시험 은 헬 파티 열리 고 악마 들 이 꽹 과 리 치 는 수준 게다가 수업 도 못하 고 이해 도 못하 겠 다,,,,,,,,,,,,,,
....... 부질없 는 수업 임 왜 듣 었 나 후회 중,,,,,,,,,,,,,,
여러분 의 시간 을 위하 아 제발 피해 가 시 어요,,,,,,,,,,,,,,
나 의 2 년 반 대학 인생 중 2 번 째 로 X 같 앗 던 수업,,,,,,,,,,,,,,
흠 ... 남 는 것 없 고 교수 님 이 뭘 가르치 고 싶 은지 잘 모르 겠 음,,,,,,,,,,,,,,
나 가 이 수업 을 듣 는 이유 는 단 하나,,,,,,,,,,,,,,
절 평이 라 그런 가 다 들 그래도 꽤 잘 주 시 ㄴ 것 같 다,,,,,,,,,,,,,,
수업 도 노 애인 쓰 어 ... 수업 에 두서 가 없 음,,,,,,,,,,,,,,
이전 에 배우 ㄴ 신 시 못하 면 좀 어렵 ㄹ 듯,,,,,,,,,,,,,,
말 하나 도 욀  X 가 지 없 게 하 시 는지 모르 겠 음,,,,,,,,,,,,,,
오페라 절 때 듣 지 말 으시 어요,,,,,,,,,,,,,,
그냥 숙제 별로 없 는 싸 강 듣 는 다는 마음 으로 들 으시 어요,,,,,,,,,,,,,,
오페라 흥미 있 어도 별로 추천 드리 는 강의 는 아니 ㅂ니다,,,,,,,,,,,,,,
그거 있 어도 크 ㄴ 소용 없 다고 하 네요,,,,,,,,,,,,,,
한 학기 열심히 발표 하고 나 이 니까 발표 실력 원래 폐 급 에서 평균 정도 로 나아지 ㄴ 것 같 음,,,,,,,,,,,,,,
글 을 숙제 떼우 는 식 으로 대충 쓰 지 않 고 진짜 고민하 많이 찾아보 고 생각하 아 서 쓰 시 면 학점 은 잘 나오 ㅂ니다,,,,,,,,,,,,,,
... 분명히 의미 있 었 고 배우 ㄴ 것 도 많 은 수업 이 었 지만 새내기 에게 는 조금 벅차 ㄴ 감 이 있 었 습니다,,,,,,,,,,,,,,
시간 제한 도 없 고 가이드라인 도 없 었 습니다,,,,,,,,,,,,,,
스피치 보다 는 글 쓰 는 것 을 집중 하 아서 가르치 어 주 시 고 그마 저 도 수업 보다 는 발표 듣 고 질문 이 더 많 아서 배우 ㄴ 것 이 생각 보다 없 는 것 같 은 느낌 이 들 ㄴ다,,,,,,,,,,,,,,
수업 진행 은 다른 강의 평 에 많 아서 안 쓰 겠 습니다,,,,,,,,,,,,,,
스피치 와 관련 되 ㄴ 내용 보다 는 글쓰기 에 대하 어 알 아 가 는 것 이 더 많 은 것 같 음,,,,,,,,,,,,,,
기본 정보 시험 없 음,,,,,,,,,,,,,,
"""이 때 전 교수 님 이 말 하 시 ㄴ 참신 하 ㄴ 글 을 쓰 고 싶 어서 근거 "," 핵심 메세지 선정 부터 고민 을 많이 하 다가 오히려 항상 글 은 급하 게 쓰 었 는데 이것 이 성적 을 잘 받 는 데 는 별로 이 ㄴ 것 같 더라구요""",,,,,,,,,,,,,,
좋 은 근거 와 핵심 메시지 가 발견 되 면 좋 겠 지만 고민 고민 하 아도 답 이 안 나오 ㄹ 때 도 많 거든요,,,,,,,,,,,,,,
뭣 도 모르 고 발표 를 하 아 버리 ㄴ 것 죠,,,,,,,,,,,,,,
저 는 그래도 이번 학기 수업 중 에서 가장 재미있 었 고 무엇 ㄴ가 하 나 배워가 는 것 같 아요,,,,,,,,,,,,,,
"""뭐 랄까 "," 제일 잘 나대 는 사람 선발 대회 같 은 느낌 이 ㅂ니다""",,,,,,,,,,,,,,
"""교양 수업 같 은 경우 "," 다양 하 ㄴ 전공 학생 들 이 모이 어 얕 은 지식 을 하 나 얻 어 가 는 수업 이 ㅂ니다""",,,,,,,,,,,,,,
"""교수 님 께서 인성 이 나쁘 시 ㄴ 분 은 아니 ㄴ지라 이 정도 로 악평 을 쏟 아 내 고 싶 지 ㄴ 않 았 지만 "," 그 와 는 별개 로 누구 ㄴ 가 가 나 에게 이 강의 에 대하 어 묻 으시 면 절대로 듣 지 말 라고 하 ㄹ 것 이 ㅁ""",,,,,,,,,,,,,,
아니 아무리 시험 이 없 다치 어도 이 정도 수준 의 강의 가 어떻하 게 꿀 교양인 지 ... 패스 페일 과목 으로 바뀌 ㄴ다면 그나마 꿀 교양 맞 기 는 하 겠 네요,,,,,,,,,,,,,,
글쎄 ... 평이 좋 아서 기대 하고 들 었 던 수업 이 ㄴ데 ' 글쎄 ' 같 은 수업 이 ㅁ,,,,,,,,,,,,,,
이것 이 말투 이 ㄴ지 는 모르 아도 짜증 내 듯이 말 하 는 화법 이 라 그냥 매 수업 마다 교수 님 짜증 받 아 주 러 가 는 것 같 았 음,,,,,,,,,,,,,,
컨텐츠 개발 은 신선하 ㄴ 주제가 많 으나 가이드라인 이 없 어 숙제 가 중구난방 하 아 지 ㅁ,,,,,,,,,,,,,,
중간 기말 은 따로 없 으며 중간 기말 레포트 로 대체 되 ㅂ니다,,,,,,,,,,,,,,
1 수업 방식,,,,,,,,,,,,,,
2 평가 방식,,,,,,,,,,,,,,
계산 이 딱 떨어지 게 나오 지 않 고 루 트 나 소수점 이 많이 나오 니 계산기 를 필 참 하 시 기 바라 ㅂ니다,,,,,,,,,,,,,,
뒤 에 가 았 다,,,,,,,,,,,,,,
그러나 개인적 으로 남 는 것 이 많 은 수업 이 이 었 습니다,,,,,,,,,,,,,,
교수 님 이 하 라는 것 신경 쓰 어서 열심히 하 고 적극적 으로 수업 참여 하 시 ㄴ다면 얻 어 가 는 것 도 많 고 공부 하 는 것 없이 학점 도 쉽 게 받 을 수 있 습니다,,,,,,,,,,,,,,
나 는 이제 까지 듣 은 과목 중 에 제일 인생 에 도움 되 는 것 같 았 다,,,,,,,,,,,,,,
빡 세 ㄴ 데 인생 에 도 움 되 ㅁ,,,,,,,,,,,,,,
주 1 회 수업 이 ㄴ데 이 주마 다,,,,,,,,,,,,,,
교수 님 강의 력 은 완전 별로 무슨 말씀 을 하 시 고 싶 은 것 이 ㄴ지 모르 겠 음,,,,,,,,,,,,,,
생각 보다 진도 도 별로 안 나가 았 다,,,,,,,,,,,,,,
기구 학 다음 은 이 수업 교수 님 학부 생 에게 ㄴ 친절 하 게 알리 어 주 시 ㅂ니다,,,,,,,,,,,,,,
1 교수 님 수업 설명 은 잘하 시 ㅂ니다,,,,,,,,,,,,,,
2 근데 실습 수업 은 100 프로 조교 대학원 생 이 아니 ㅁ,,,,,,,,,,,,,,
3 조교 독단 으로 진행 하 는 수업 은 불안 하 ㅂ니다,,,,,,,,,,,,,,
"""기준 미달 이 면 D "," F 나오 ㅁ""",,,,,,,,,,,,,,
본인 전공 분야 도 아니 ㄴ데 떠맡 아서 수업 하 시 ㅁ,,,,,,,,,,,,,,
플젝  진짜 2 주 우 동안 열심히 하 았 는데 시간 과 노력 대비,,,,,,,,,,,,,,
당신 이 반도체 로 진학 또는 취업 하 ㄹ 계획 이 없 다면,,,,,,,,,,,,,,
반도체 공정 을 가르치 는 곳 은 굳이 학교 가 아니 어도 가르치 어 줄 곳 이 많 고,,,,,,,,,,,,,,
쓰레기 수업 절대 듣 지 말 아 셈 진심 이런 노답 교수 는 처음 보 ㅁ,,,,,,,,,,,,,,
성적 도 안 주 고 맨날 지각 하고 숙제 나 퀴즈 는 겁나 많 고,,,,,,,,,,,,,,
출장 가 ㄴ다고 수업 빨리 끝나 거나 수업 늦 게 오 는 일 많 음,,,,,,,,,,,,,,
공지 도 없이 수업 안 온 적 있 음,,,,,,,,,,,,,,
도움 이 많이 되 었 던 과목,,,,,,,,,,,,,,
경제 수학 만큼 은 어쩌 ㄹ 수 없 다고 공언 하 시 었 다,,,,,,,,,,,,,,
잘 모르 겠 음,,,,,,,,,,,,,,
달 원 찡 재미있 고 강의 잘 가르침 1 학년 들 은 들 어 두 면 미 시 나 거시 공부 하 ㄹ 때 많이 도움 되 ㄹ 것 이 다,,,,,,,,,,,,,,
저 는 고 학년 이 ㄴ데 수학 을 못하 아서 어렵 었 으나 그만큼 성적 을 관대 하 게 주 시 ㄴ 듯,,,,,,,,,,,,,,
이과 생 이 가 면 왜 오 았 냐고 극 딜 당하 ㅁ,,,,,,,,,,,,,,
문제 내 고 답 을 안 보이 어 주 ㅂ니다,,,,,,,,,,,,,,
수업 을 일단 알 ㄴ 들 음,,,,,,,,,,,,,,
그래서 그냥 자습 하 아서 잘 받 기 는 하 았 는데 ..... 수업 은 별로,,,,,,,,,,,,,,
A - 비마 는 없 고 +  제 로 는 91 비율 로 주 시 었 음,,,,,,,,,,,,,,
경제 원론 과 함께 가장 기초 가 되 는 학문 은 맞 지만 신입 생 들 한테 는 어렵 ㄹ 수 밖에 없 는 과목 .. 특히 나 교수 님 께서 아직 탑재 안 되 ㄴ 지식 에 대하 아서 도 학생 들 이 알 고 있 다고 생각 하 시 고 강의 를 진행 하 시 니 심도 있 는 복습 이 필요 하 ㅁ,,,,,,,,,,,,,,
이번 에 코로 나라 서 그리하 었 는지 학점 개 잘 주 ㅁ,,,,,,,,,,,,,,
하 ㄹ 정도 는 아니 ㄴ데 수업 시간 에 배우 ㄴ 기억 이 안 날 ㅂ니다,,,,,,,,,,,,,,
또 뭐 있 냐 하도 짜증나 는 것 이 많 아서 다 쓸 수 가 없 다,,,,,,,,,,,,,,
단연코 대학 오 아서 듣 은 강의 중 최악 의 강의,,,,,,,,,,,,,,
왜 이 교수 님 의 강의 평이 3 점 대인 지 의문 이 네요,,,,,,,,,,,,,,
수업 을 듣 는데 이해 가 안 되 ㅁ,,,,,,,,,,,,,,
나 에게 남 은 것 은 교수 님 이 하 ㄴ 숨 을 많이 쉬 ㄴ다는 사실 뿐,,,,,,,,,,,,,,
어렵 고 진짜 1 학년 은 안 듣 는 것 추천 이 요 ...,,,,,,,,,,,,,,
교수 님 혼자 이해 하고 설명 하 면서 나가 는 수업 이 기 때문 에 1 학년 은 안 듣 는 것 이 좋 을 것 같 음,,,,,,,,,,,,,,
