출 결도 2 번 봐  근데 아마 다음 학기 에 는 이러 지 않 을 것 에 요 온오 프 가 아니 ㄹ 것 이 ㅂ니다,,,,,,,,,,,,,,
그래도 안 듣기 에 ㄴ 좀 아깝 ㄴ 우리 학교 몇 안 되 는 꿀 교양,,,,,,,,,,,,,,
... 조원 복 불복 이 길 ㄴ 한데 패 폐 + 2 학점 + 부담 1 도 없 음,,,,,,,,,,,,,,
"""수업 시간 에 흥미 로 울 ㄴ 내용 도 많이 배우 고 "," 교수 님 께서 수업 과 관련 하 아 매 수업 시간 마다 하나 하나 피드백 을 받 으시 어서 다음 수업 시간 에 어떻하 게 하 겠 다라고 말씀 하 아 주 시 어서 좋 았 습니다""",,,,,,,,,,,,,,
"""PF 수업 치고 핸드폰 사용 "," 출 결석 과 관련 하 아 엄격 하 다고 생각하 ㄹ 수 도 있 습니다""",,,,,,,,,,,,,,
"""하지만 배우 ㄴ 것 도 많 고 "," 교수 님 께서 수업 시간 에 알리 어 주 시 는 유익 하 ㄴ 정보 도 많 은 도움 이 되 ㅂ니다""",,,,,,,,,,,,,,
교수 님 께서 재미있 으시 고 배우 는 내용 또한 부담 이 없 었 기에 하 ㄴ 학기 동안 편안 하 게 듣 을 수 있 었 습 ㅂ니다,,,,,,,,,,,,,,
.. 그럼 에 도 불구 하고 PF 2 학점 받 고 싶 으면 듣 으시 기 ㄹ ..,,,,,,,,,,,,,,
패 폐 라 부담 없 을 줄 알 았 는데 숙제 양 빡 시 어요,,,,,,,,,,,,,,
조 는 성비 남 4 여 2 정도 로 맞추 고 과도 같 은 과 끼리 배정 안 되게 신경 쓰 심,,,,,,,,,,,,,,
남 5 여 1 같 은 ..,,,,,,,,,,,,,,
"""조원 들 이랑 친하 아 지 면 꿀 이 ㄴ데 "," 안 친하 아 지 면 그것 만큼 심하 ㄴ 천년 의 침묵 이 없 음""",,,,,,,,,,,,,,
엉엉 .. 다음 에 도 뵙 고 싶 어 여 교수 님 싸 라 해 오 .. 열정적 이 ㄴ 교수 님 이 라는 것 을 하 ㄴ 학기 동안 많이 느끼 었 습니다,,,,,,,,,,,,,,
숙제 로 2 페이지 꽉 채우 어서 써내 는 레포트 3 번 이 거만 하 면 2 학점 임 양호 하 ㄴ 수업,,,,,,,,,,,,,,
숙제 2 P 3 번 쓰 는 것 은 힘들 지만 시험 없 고 PF 니까 꼭 잡 으시 어요,,,,,,,,,,,,,,
"""다만 내용 에 관하 열 는 조금 필터링 하 ㄹ 필요 가 있 는 것 이 "," 고등학교 5 학년 이 아니 ㄴ 대학교 2 학년 생 으로서 공부 만 하 기 보다 는 다양 하 ㄴ 활동 으로 경험 을 쌓 는 것 을 강조 하 시 는데 공대 생 으로서 는 현실 에 와 닿 지 않 고 도저히 안 맞 는 부분 도 있 던 것 같 습니다""",,,,,,,,,,,,,,
살 면서 하 ㄴ 글 로 보고서 길 게 쓸 일 없 는 공대 생 이 라 고작 숙제 2 쪽 쓰 는 것 이 고통 스럽 었 지만 패 폐 라 참 음,,,,,,,,,,,,,,
폐 노 폐 라 좋 지만 폐 노 페치 고 숙제 가 많 다,,,,,,,,,,,,,,
좋 았 던 것 은 타 아 과 생 들 과 조르 ㄹ 이루 어서 서로 를 알 아 가 ㄹ 수 있 었 다는 점 을 꼽 고 싶 습니다,,,,,,,,,,,,,,
폐 패 란 이런 수업 이 구나 하 았 음,,,,,,,,,,,,,,
하 ㄹ 것 이 많 다는 사람 들 은 도대체 얼마나 꿀 을 바라 는 것 이 ㄴ지 모르 겠 음,,,,,,,,,,,,,,
패 패치 고 하 ㄹ 것 많 은데 신경 많이 안 쓰 면 하 ㄹ 말 ㄴ 합 ㅂ니다,,,,,,,,,,,,,,
조발 표 한번 있 는데 다 들 폐 패 라 그렇 ㄴ지 열심히 준비 하 ㄴ 조 는 별로 없 었 어요,,,,,,,,,,,,,,
학점 채우 기 는 좋 은데 1 학년 과목 대진 탐 보다 는 시키 는 것 이 많 아서 별로 .. 조원 들 이 좋 다면 괜찮 지만 조원 이 별로 면 수업 자체 가 지루 하 아 지 ㅁ,,,,,,,,,,,,,,
수업 내용 은 별 롭  솔직히 수업 외 에 딴 부분 에 더 깐깐 하 아서 혹시 결석 이 라도 하 ㄹ 일 있 으면 알 ㄴ 듣 으시 는 것 이 나 음,,,,,,,,,,,,,,
솔직히 이 정도 하 고 2 학점 주 ㄴ다는데 굳이 알 ㄴ 듣 을 이유 가 없 는 것 같 음,,,,,,,,,,,,,,
자신 의 운 이 좋 은 사람 이 다 그러면 하 ㄴ 학기 편하 게 2 학점 받 을 수 있 고 아니 라면 하 ㄴ 학기 수업 내내 고 역임,,,,,,,,,,,,,,
조원 잘 만나 면 재미있 는 수업 되 고 아니 면 조금 힘들 ㄴ 수업 이 되 ㄹ 것 같 네요,,,,,,,,,,,,,,
패 폐 라 무난 하 게 2 학점 받 을 수 있 을 듯,,,,,,,,,,,,,,
"""수강 전 에 강의 평 을 많이 찾아보 았 었 는데 호불호 가 많이 갈리 ㄹ 뿐 더러 듣 지 마르 아 는 얘기 가 많 아서 걱정 을 많이 하 았 는데 "," 생각 보다 훨 재미있 는 수업 이 었 다""",,,,,,,,,,,,,,
2 학점 에 페페 에 일주일 한번 수업 이 면 이 정도 면 감사 하 게 수업 들 으면 되 ㄹ 듯,,,,,,,,,,,,,,
취업 관련 에서 도움 을 얻 는 것 보다 다른 과 사람 들 이랑 만나 고 얘기 하 ㄹ 수 있 는데 이 수업 의 가장 크 ㄴ 메리트 라고 생각하 ㄴ 다,,,,,,,,,,,,,,
"""1 ", 2 , 3 , 4 각 학년 마다 있 는 것 은 알 것 고 ," 1 학년 대진 탐 생각 하고 듣 었 는데 넘나 귀찮 쓰""",,,,,,,,,,,,,,
하 는 것 이 많 은 줄 은 알 았 는데 학기 말 에 조 별 PPT 만들 고 발표 하 아야 되 어서 꽤 나 귀찮 음,,,,,,,,,,,,,,
이 수업 에서 가장 좋 은 것 은 조원 들 하고 많이 친 해지 ㄹ 수 있 다는 점 이 ㅂ니다,,,,,,,,,,,,,,
늦 은 시간 에 2 학점 을 투자 하 지만 얻 어 가 는 것 이 많이 없 는 수업,,,,,,,,,,,,,,
PF 이 ㄴ 것 말 고 는 진짜 듣 을 것 이 없 음,,,,,,,,,,,,,,
학점 채우 는 것 만 하 어 도 만족 이 ㄴ데 경력 개발 센터 정보 도 주심 개 굳,,,,,,,,,,,,,,
역대 급 쓰레기 수업 PF 아니 였 으면 듣 지 도 않 았 을 수업,,,,,,,,,,,,,,
그냥 딱 학점 2 점 줍 어 가 는 수업,,,,,,,,,,,,,,
대신 얻 어 가 는 것 2 도 없 고 수업 시간 에 폰 못하 아서 좀 답답,,,,,,,,,,,,,,
이 것 지정 좌석 에 맨날 조 모임 에 숙제 에 진짜 개 힘들 고 짜증 나 ㅁ,,,,,,,,,,,,,,
시험 이랑 숙제 도 개 빡 치고 핸드폰 사용 하 면 감점 에 무슨 중딩 이 ㄴ 줄 진짜 이 것 학점 때 매 듣 는다구요,,,,,,,,,,,,,,
가르치 는 내용 이 예시 가 극단적 이 고 공감 가 는 것 도 딱히 없 음,,,,,,,,,,,,,,
나름 유익 하 ㄴ 강의 던데 모르 는 정보 도 알리 어 주 고 쉬엄쉬엄 하 어 도 되 고,,,,,,,,,,,,,,
진로 를 찾 는 데 전혀 도움 이 되 지 않 고 그냥 1 시간 반 쓸 것 쓰 다,,,,,,,,,,,,,,
2 학점 패 폐 라 강의 평가 안 보고 도 수강 하 ㄹ 사람 들 넘치 겠 지만,,,,,,,,,,,,,,
기업 의 이해 랑 고민하 듣 었 는데 확실히 꿀 이 기 ㄴ 하 ㅂ니다 별거 하 는 것 없이 이 학점 얻 어 가 요,,,,,,,,,,,,,,
그래도 2 학점 패스 페일 이 니 괜찮 아요,,,,,,,,,,,,,,
대놓고 수업 시간 에 학점 자 ㄹ 줄 터 이 니까 ㄴ 많 은 활동 을 하 라고 하 았 습니다,,,,,,,,,,,,,,
칠판 에 판서 하 시 는 것 도 맥락 이 없 는 느낌 이 고 솔직히 아침 수업 이 었 는데 잠 만 오 고 시간 아깝 었 습니다,,,,,,,,,,,,,,
"""4 저 는 개인적 으로 국제 경영 에 대하 어 많이 배우 ㄴ 것 같 아서 좋 았 는데 "," 호불호 가 많이 갈리 ㄹ 수업 이 라 잘 생각 하 시 고 수강 신청 하 면 좋 을 것 같 아요""",,,,,,,,,,,,,,
아 2016 년도 에 이 교수 님 수업 듣 었 었 는데 그때 보다 변한 것 이 하나 도 없 음,,,,,,,,,,,,,,
그리고 범위 가 많 다는 데 솔직히 페이지 수만 많 지 중간 중간 건너뛰 는 것 도 많 고 그래프 나 그림 그런 것 다 빼 면 어 마 어마 하 ㄴ 정도 는 아니 ㅁ,,,,,,,,,,,,,,
"""강의 평이 안 좋 아서 크 ㄴ 기대 없이 듣 었 는데 "," 좋 은 강의 였 어요""",,,,,,,,,,,,,,
"""무엇 보다 도 조 별 활동 ", 숙제 ," 발표 가 없 는 점 이 가장 크 ㄴ 메리트 이 기 도 하 아요""",,,,,,,,,,,,,,
"""또 국제 경영 강의 가 4 개 정도 있 는데 "," 만약 오늘 못 가 았 으면 다른 강의 시간 에 가 도 출석 인정 하 어 주 심 개 꿀 강의 내용 도 풍부 하고 이해 하 면서 공부 하 면 1 도 안 어려움 그치만 시험 이 객관식 이 ㄴ데 모두 고르 시오 라서 공부 안 하 면 안 되 ㅁ""",,,,,,,,,,,,,,
뭐 가 나오 ㄹ 줄 도 모르 고 뭐 가 중요 하 ㄴ 지도 모르 ㄴ 상태 에서 공부 하 아야 하 ㅁ,,,,,,,,,,,,,,
그냥 발표 없 어서 좋 았 고 강의 는 그럭저럭,,,,,,,,,,,,,,
교과서 를 배우 ㄴ 다기 보다 는 교수 님 이 알 고 계시 는 국제 경영 지식 을 배우 ㄴ다는 것 이 더 맞 는 말 이 ㄴ 것 같 음,,,,,,,,,,,,,,
듣 어서 는 안 되 는 강의 숙제 는 숙제 대로 많 고 학점 도 깐깐 하 게 주 심 수업 을 통하 아서 얻 는 것 은 나 가 이 과목 을 왜 듣 었 을까 하 는 후회 뿐 ..,,,,,,,,,,,,,,
결론 부터 얘기 하 면 얻 어 가 는 것 없 는 강의 + 부담 크 게 없 는 강의 + 학점 잘 주 기 ㄹ 바라 면 안 되 는 강의 ... 숙제 는 회사 를 마케팅 믹스 별 로 분석 하 아서 PPT 형 으로 제출 하 는 레포트 가 있 습니다,,,,,,,,,,,,,,
시험 은 지금 까지 배우 ㄴ 것 중 에서 4 가지 의 주제 를 고르 아서 서술 하 는 서술 형 문제 로 출제 되 고요,,,,,,,,,,,,,,
나 는 이 수업 되게 괜찮 았 는데 왜 하 게 뭐 라 하 는지 이해 가 안 가 네,,,,,,,,,,,,,,
근데 이것 가지 고 뭐 라 하 는 애 들 은 공부 안 하 아 놓 고 학점 안 나오 았 다고 빼액 하 는 거로 밖 에 이해 안 되 어 ...,,,,,,,,,,,,,,
딱 경영 수업 느낌 개인 발표 있 고 듣기 말 ㄴ 하 는 강의 식수 업 시험 은 좀 어렵 ㄴ 편 이 고 교수 님 발음 이 좀 안 좋 기 는 하 어 도 인성 은 좋 으 시 었 음,,,,,,,,,,,,,,
개인적 으로 는 국어학 쪽 에 흥미 가 없 었 는데 의 외로 재미있 고 얻 어 가 ㄹ 것 이 많 은 수업 이 었 어요,,,,,,,,,,,,,,
이 과목 듣 다가 대통령 꾸 을 꾸 게 되 었 습니다,,,,,,,,,,,,,,
"""학점 만 대충 받 으려고 듣 는 사람 한테 ㄴ 그냥 고통 만 남지 만 "," 열심히 열정 있 는 사람 은 고통 + 지식 을 함께 얻 음""",,,,,,,,,,,,,,
그래도 편하 게 듣기 에 좋 았 으니 별점 3 점 짜리 강의 가 되 겠 음,,,,,,,,,,,,,,
시작 은 교양 수업 같 은 데 ...,,,,,,,,,,,,,,
교수 이 ㅁ 이 개 쿨 남 이 고 재미있 음,,,,,,,,,,,,,,
전공 내용 남 는 것 도 없 고 수업 을 안 올리 어 주 어서 짜증 나 았 지만,,,,,,,,,,,,,,
교양 인정 도 안 되 고 일반 선택 이 라고,,,,,,,,,,,,,,
양이 많 기 는 한데 중간 없 고 기말 말 ㄴ 보 아서 그런 거라 이런 것 감안 하 면 별로 많 지 도 않 은 듯,,,,,,,,,,,,,,
교수 님 발음 도 안 좋 으시 어서 뭐 라 하 시 는지 도 잘 모르 는 경우 가 많 고 판서 는 최악 수준 에다 범위 랑 암기 량 이 많 은 편 이 ㄴ데 상당히 지엽적 이 ㄴ 부분 에서 문제 출제 ... 진짜 후회 중,,,,,,,,,,,,,,
..... 특히 관심 잇 는 과목 아니 면 ..... 학점 내려가 고 싶 지 않 으면 절대 수강 하 지 말 아 로 라 ... 사람 의 개 으른 본성 을 무시 하 면 안대 애,,,,,,,,,,,,,,
이 아니 라 자기 맘대로 임 성적 자기 멋대로 줌 시험 이 왜 있 나 싶 을 정도 로 시험 점수 개 무시 하고 아무 도 모르 는 기준 으로 학점 부여 하 ㅁ,,,,,,,,,,,,,,
신세대 문화 는 무조건 비판 하 고 부터 봄 더 이상 배우 ㄹ 것 이 없 다고 느끼 ㄴ 수업,,,,,,,,,,,,,,
그리고 생각 보다 영어 잘 하 시 는 분 별로 없 으 시 지레 겁 먹 으시 ㄹ 필요 없 는 것 같 아요,,,,,,,,,,,,,,
그래도 별 2 개 주 는 이유 는 교수 님 이 나 도 착하 시 고 학생 들 을 가르치 려는 열의 가 상당 하 시 어서,,,,,,,,,,,,,,
듣기 30 단어 외우 기 40 무엇 이 ㄴ지 모르 겠 는 외국식 문법 과 음절,,,,,,,,,,,,,,
수업 퀄리티 를 생각 하 면 돈 아깝 ㄴ 수업 은 맞 는데 수업 하나 정도 는 여유 를 느끼 며 부담 없이 쉬 면서 듣 고 싶 다면 추천 하 ㅁ,,,,,,,,,,,,,,
배우 ㄴ 것 도 없 고 학점 도 못 얻 어 가 ㄴ 강의 .. 등록금 아깝 었 다,,,,,,,,,,,,,,
수업 이 답답 하고 재미없 으면 학점 이 라도 잘 받 아야 하 았 는데 고학 번 이 많 아 학점 은 압살 당하 았 다,,,,,,,,,,,,,,
숙제 없 고 수업 내용 도 쉽 ㄴ 데 에 그만큼 배워가 는 것 이 없 는 수업,,,,,,,,,,,,,,
교수 한마디 면 되 ㄹ 것 을 반복 하 아서 20 분 동안 똑같 은 말 하 고 일찍 끝내 도 되 는 것 을 굳이 쓸데없 는 말해 서 시간 꽉 꽉 채우 ㄴ다,,,,,,,,,,,,,,
꿀 이 기 ㄴ 하나 왜 앉 아서 이것 ㄹ 하 는지 매 순간순간 의 문 가득 하 아 지 ㅁ,,,,,,,,,,,,,,
1 수업 영어 실력 절대 안 늘 음,,,,,,,,,,,,,,
""".. 중학교 "," 고등학교 기초 내 시 ㄴ 수업 반 듣 는 느낌 과 딴 길 로 자주 새 어 버리 ㄴ다""",,,,,,,,,,,,,,
"""사실 기대 하고 듣 은 수업 은 아니 었 으나 "," 이 정도 로 별 가치 없 는 수업 일 줄 은 모르 았 음""",,,,,,,,,,,,,,
"""수업 계획표 ", 내용 ," 평가 내용 도 절대 누출 안 시키 려 잘 안 줌""",,,,,,,,,,,,,,
로 지정 좌석 에 4 이 ㄴ 조 별 로 앉히 심 부담 은 1 도 없 지만 얻 는 것 도 없 음,,,,,,,,,,,,,,
다시 한 번 말씀 드리 지만 학점 에 대하 ㄴ 가치 를 영어 실력 증진 에 대하 ㄴ 가치 보다 더 높 게 평가 하 시 ㄴ다면 최고 의 교양 이 라 생각 되 ㅂ니다,,,,,,,,,,,,,,
"""실용 중국어 표현 을 많이 배우 ㄹ 수 있 는 기회 이 었 고 "," 또 여러 중국인 친구 들 과 중국어 로 이야기 하 면서 많 은 표현 을 배우 고 어휘력 도 늘 수 있 는 좋 은 기회 이 었 음""",,,,,,,,,,,,,,
나 는 대학교 에서 언어 를 가르치 ㄹ 때 ㄴ 보다 본질적 으로 접근 하 ㄹ 줄 알 았 는데 나 가 괜하 ㄴ 망상 을 하 ㄴ 것 같 음,,,,,,,,,,,,,,
본인 이 직접 집필 하 았 는데 솔직히 학교 에서 쓰 는 거라 산거 지 이것 ㄹ 서점 에서 돈 주 고 사라 면 절대 알 ㄴ 살 ㄹ 책,,,,,,,,,,,,,,
"""3 나 는 분명 고등학교 를 졸업 하 았 는데 "," 다시 학교 를 다니 는 이 기분 은 무엇 이 ㄹ까""",,,,,,,,,,,,,,
패턴 많이 말 하 면서 겉 으로 는 도움 되 ㄴ다고 많이 언급 하 지만 1 시간 15 분 동안 배우 는 것 이 없 습니다,,,,,,,,,,,,,,
강의 퀄리티 수업 은 1 학년 대상 으로 기초 중국어 이 ㅂ니다,,,,,,,,,,,,,,
비 대면 이 라 꿀 이 었 지만 종교 관련 되 ㄴ 수업 이 ㄴ 만큼 그냥 교수 님 입맛 맞추 어서 답안 쓰 시 어요,,,,,,,,,,,,,,
비 대면 이 라 꿀 강의 이 었 고 절 평 아니 면 공부 하 ㄹ 것 이 많 다,,,,,,,,,,,,,,
"""다양 하 ㄴ 종교 들 을 주차 별 로 하나 씩 배우 어 요 불교 ", 기독교 , 유교 , 조로아스터교 , 도교 , 이슬람교 ," 힌두교 등 등""",,,,,,,,,,,,,,
비 기독교 인 이 지만 좋 았 던 수업 약간 상식 이나 이런 것 쌓기 좋 은 수업 이 ㄴ데 교수 님 사담 이랑 수업 이랑 약간 구별 안 되 고 그런 것 이 시험 에 나오 ㄴ다는 단점 이 있 지만 교수 님 도 좋 고 대체적 으로 좋 았 던 수업,,,,,,,,,,,,,,
근데 솔직히 수업 듣 어 보 ㄴ 적 없 어서 뭐 라 나 가 하 ㄹ 입장 은 아니 구,,,,,,,,,,,,,,
기독교 분 들 이 많 지만 그래도 열심히 하 ㄴ다면 기독교 가 아니 라서 학점 을 못 받 고 그런 것 은 없 어요,,,,,,,,,,,,,,
강의 평 은 무조건 별 다섯 개 를 주 어야 하 ㄴ다느니 등 무엇 ㄴ가 나 가 짱 이야 마인드 를 가지 고 계시 ㄴ 것 같 다,,,,,,,,,,,,,,
책 만 달달 외우 면 되 고 수업 은 남 는 것 없 음,,,,,,,,,,,,,,
배워가 는 것 도 없 고 학점 은 채우 어 주 기 ㄴ 하 는데 비추 이 ㅁ,,,,,,,,,,,,,,
.... 배우 는 것 도 없 고 보고서 랑 발표 점수 매기 는 기준 이 무엇 이 ㄴ지 도 모르 겠 음,,,,,,,,,,,,,,
교수 님 이 누구 가 되 었 든 대부분 한 학기 만 수업 하 는 초빙교수 무역전 시론 이 라는 수업 듣 지 말 아 ... 숙제 도 시간 에 비례 하 아서 점수 안 나오 ㅁ,,,,,,,,,,,,,,
"""아직 까지 궁금 하 ㄴ 것 은 본인 이 무역 회사 사장 이 라면서 ", 자기 옷 명품 브랜드 소개 하고 , 가격대 알리 어 주 고 , 돈 자랑 하고 , 학생 들 한테 이것 이 현실 이야 이래 놓 고 ," 왜 굳이 무역 관련 공기업 이랑 숭실대 를 비롯 하 ㄴ 수많 은 무역학 과 있 는 대학 에서 강의 하 면서 돈 버  궁금 하 ㅁ""",,,,,,,,,,,,,,
서술 형 1 문제 이 ㄴ데 뭐 나오 ㄹ지 알리 어 주심,,,,,,,,,,,,,,
조 모임 도 없 고 숙제 도 딱 한 번 사건 에 대하 아서 조사 하 는 것 밖에 없 어서 편 햐 요,,,,,,,,,,,,,,
하지만 내용 이 재미있 고 한 번 도 배우 어 본 적 없 는 내용 이 라서 흥미 롭 게 듣 은 것 같 네요,,,,,,,,,,,,,,
말 그대로 흥미 로 울 ㄴ 교양 을 배우 는 느낌,,,,,,,,,,,,,,
지금껏 들어오 았 던 그 많 은 전공 교양 강의 에서 기억나 는 것 합치 어도 이 강의 에서 기억 에 남 는 거보 다,,,,,,,,,,,,,,
일학 년 이 라 그런 가 일학 년 은 듣 지 말 아라 요,,,,,,,,,,,,,,
그래서 필기 정리 가 잘 안 되 고 그래서 시험 망 ...... 수업 자체 는 대학교 양다운 교양 이 에요,,,,,,,,,,,,,,
일학 년 은 왜 듣 지 마르 아 고 하 는지 여실히 느끼 었 당 .. 물론 대학 교양 답 은 강의 이 었 고 수업 도 흥미 있 고 퀄리티 도 높 았 다,,,,,,,,,,,,,,
열심 히 하 ㄹ 자신 없 으면 일학 년 들 은 학년 이 조금 더 올라서 들 으면 좋 을 것 같 다,,,,,,,,,,,,,,
진심 교양 다운 교양 의 끝판 왕,,,,,,,,,,,,,,
"""주로 국가 정보기관 들 과 정보사 들 을 주제 로 수업 을 진행 하 는데 "," 역사 의 비하인드 스토리 들 을 듣 는 것 같 아서 재미있 고 전직 외교관 이 시라 서 그렇 ㄴ지 전하 아 주 시 는 정보 들 도 공신력 이 있 습니다""",,,,,,,,,,,,,,
그러나 수업 의 질 은 진짜 대학 수업 같 았 습니다,,,,,,,,,,,,,,
정보활동 이 라는 것 에 대하 아서 무지 하 았었 는데 이 강의 를 통하 아서 많이 얻 고 가 ㅂ니다,,,,,,,,,,,,,,
대학 에서 얼마 못 듣 는 도움 되 는 수업 중 하나 지만,,,,,,,,,,,,,,
다 들 열심히 수업 들 으니 1 학년 은 신청 안 하 시 는 것 이 좋 은 것 같 습니다,,,,,,,,,,,,,,
5 점 주 고 싶 을 만큼 스파이 니 국제정치 니 관심 전혀 없 었 는데 도 하 ㄴ 학기 내내 재미있 고 유익 하 았 음,,,,,,,,,,,,,,
시간 맞 는 수업 찾 아 들어가 ㄴ 거라 이런 수업 이 ㄴ지 모르 았 음,,,,,,,,,,,,,,
그리고 제일 안 좋 았 던 것 은 이번 에 도 족보 가 돌 았 다는 소문 이 있 습니다,,,,,,,,,,,,,,
1 필기 가 많 습니다,,,,,,,,,,,,,,
2 내용 이 유익 하 ㄴ 지 모르 겠 습니다,,,,,,,,,,,,,,
필기 량 많 고 수업 이 빡 세 기 는 하지만 수업 내용 이 흥미 롭 고 또 배우 어 가 ㄴ다는 느낌 을 많이 받 았 어요,,,,,,,,,,,,,,
약간 뭐 랄까 ... 노동법 지식 자체 보다 는 개인 의 글 빨 로 승부 보 는 과목 이 ㄴ 것 같 음,,,,,,,,,,,,,,
"""한국 현재 노동 계 의 상황과 노동법 을 같이 배우 ㄹ 수 있 어서 좋 았 고 ", ," 교수 님 의 사견 이 강의 에 반영 이 안 되 ㄴ다고 는 하 ㄹ 수 없 지만 중립 을 지키 려고 하 시 ㅂ니다""",,,,,,,,,,,,,,
저녁 수업 이 ㄴ데 한 시간 반 수업 하고 끝내 주 시 어서 제일 좋 았 음,,,,,,,,,,,,,,
굉장히 편하 ㄴ 수업 이 지만 얻 어 가 는 것 은 없 는 수업 이 라서 3 점 드리 ㅂ니다,,,,,,,,,,,,,,
"""무엇 이 ㄴ가 를 배우 고 싶 으면 듣 지 말 고 "," 설렁설렁 공부 하고 싶 으면 들 으시 어요""",,,,,,,,,,,,,,
딱히 배우 는 것 은 없 고 배워가 는 것 은 없 어요,,,,,,,,,,,,,,
모든 강의 내용 이 ㄴ 머릿속 에 남 는 것 은 아니 지만 중간 과 기말 그리고 팀 프로젝트 하 면서 국제시장 조사 에 대하 아서 배우 는 것 은 확실히 있 는 듯,,,,,,,,,,,,,,
기계공학 도 라면 유체역학 을 들 었 을 테 고 유체역학 을 듣 었 다면 실험 은 당근 생각 보다 실험 꿀 이 고 보고서 열 번 내 지만 부담 되 지 않 음,,,,,,,,,,,,,,
학점 채우 어 주 시 는 것 같 고 배우 ㄹ 것 이 많 은 수업 이 었 음,,,,,,,,,,,,,,
우선 오선영 교수 님 이랑 같 은 학기 에 같 은 과목 가르치 시 어서 학생 들 이 많이 듣 었 는데 강의 력 은 좀 떨어지 는 느낌 이 있 지만 재미있 으시 고 학생 을 배려 많이 하 아 주 시 어요,,,,,,,,,,,,,,
"""진짜 보드 타 ㄹ 줄 1 도 모르 았 고 "," 배우 면서 도 많이 넘어지 고 느 는 느낌 이 알 ㄴ 듣 어서 힘들 었 는데 두 번 째 수업 때 직접 자세 봐주 시 고 교정 하 아 주 시 어서 감사 하 았 음""",,,,,,,,,,,,,,
남 는 교양 그냥 줍 었 던 것 이 ㄴ데 춤 추 어 야 되 ㄴ 대서 처음 에 ㄴ  오 지 었 는데 수업 진행 되 ㄹ수록 학기 내내 이 수업 을 제일 열심히 참여 하 았 다,,,,,,,,,,,,,,
"""이 수업 이 이 번 학기 유일 하 ㄴ 낙 이 었 고 "," 배드민턴 도 많이 배우 었 고 실력 을 키우 었 다""",,,,,,,,,,,,,,
조 짜 서 경기 하 는데 진짜 재미있 고 학점 도 잘 주심 사랑 하 ㅂ니다,,,,,,,,,,,,,,
과목 자체 가 느끼 기 에 굳이 의 미부 여 하 아 가 면서 공부 하 ㄹ 거리 만들 는 것 같 다고 느끼 었 습니다,,,,,,,,,,,,,,
""".. 그래도 이 수업 을 듣 고 생활 습관 병 같 은 질병 들 이나 흡연 ", 음주 에 대하 어 생각하 아 보 면서 이것 들 이 얼마나 안 좋 은지 , ," 그리고 나 의 몸 을 챙기 고 아프 지 말 아야 하 겠 다""",,,,,,,,,,,,,,
학점 버리 고 시험 도 어디 서 내 는 지도 모르 겠 고 얻 어 가 는 것 하나 도 없 는 수업 이 구요,,,,,,,,,,,,,,
음 진짜 왜 이것 ㄹ 배우 어야 하 는지 이해 가 도대체 도무지 안 가 는 수업,,,,,,,,,,,,,,
말투 가 지나치 게 상냥 하 시 ㄴ 편 이 라 그런 듯 내 기준 개 꾸 ㄹ 교양 맞 았 음,,,,,,,,,,,,,,
목소리 가 지나치 게 상냥 하 ㄴ 것 을 싫어하 거나 대면 수업 은 어떻 ㄹ 지 ㄴ 모르 ㄴ다는 점 에서 별 다섯 개 는 못 줄 듯,,,,,,,,,,,,,,
어 쨋 들 ㄴ 나 는 코로나 덕분 에 꿀 빨 았 음,,,,,,,,,,,,,,
전공 수업 이 나 의 인생 명강의 일 줄 은 모르 았 다,,,,,,,,,,,,,,
진짜 로 기계 공학 과 2 년 간 만나 ㄴ 교수 님 들 중 최고 라고 말 하 ㄹ 수 있 다,,,,,,,,,,,,,,
갓 갓 갓 줄 ㄴ 성 솔직히 뭐 배우 는 지 이 하 아 못하 았 지만 어쨌든 A + 나오 았 으니까 그저 빛 이 ㅂ니다,,,,,,,,,,,,,,
그 대신 열정 이 있 으면 얻 어 가 는 것 이 많 은 강의 이 다,,,,,,,,,,,,,,
"""프로젝트 비율 보다 는 시험 비율 이 더 크 므로 "," 프로젝트 를 엄청나 게 잘 하 기 보다 는 차라리 시험 을 잘 보 는 것 을 추 천 하 ㅂ니다""",,,,,,,,,,,,,,
"""그러나 이 수업 은 UIUX "," 특히 인터 션 디자인 에 관하 ㄴ 디자인 방법론 을 배우 는 것 으로 상당 하 ㄴ 도움 이 되 ㄴ다""",,,,,,,,,,,,,,
"""으로 후년 에 변경 점 이 없 다면 "," 가 나 반 을 우선적 으로 잡 도록 하 자""",,,,,,,,,,,,,,
빈말 로 도 쉽 다고 는 하 ㄹ 수 없 는 수업 이 지만 저 는 게임 에 관심 이 있 어서 하 ㄴ 학기 만족 하 며 들 었 습니다,,,,,,,,,,,,,,
게임 은 짱 이야 최고 야 라는 마음 을 수강 기간 동안 새기 면서 살아가 ㄴ다면 좋 은 성적 가능,,,,,,,,,,,,,,
"""비율 은 채우 어 주심 "," 영어 수업 일부러 듣 을 것 추천""",,,,,,,,,,,,,,
아 그리고 경제학 과 에서 드물 게 조 모임 있 는 수업 ... 피하 았 어야 하 았 는데 조원 평가 하 ㄹ 기회 있 다고 하 시 었 는데 없 어서 찌 증 나 았 다,,,,,,,,,,,,,,
"""다만 지금 돌이키 어 보 면 수업 이 전공 느낌 보다 교양 느낌 이 강하 았 고 "," 기업 금융 에 대하 아서 는 배우 기 힘들 다""",,,,,,,,,,,,,,
"""평가 기준 이 금융 ", 경제 , 재무관리 등 교과목 이해 정도 가 아니 ㄴ ," 수업 이나 프린트 에 나오 ㄴ 단어 의 갯수 가 평가 기준 .. 개인적 의견 으로 ㄴ 상경 계열 학생 보다 는 인문대 생 이 점수 를 잘 받 는 시험 이 ㅁ""",,,,,,,,,,,,,,
나 가 진짜 상경 계열 수업 많이 듣 어 보 았 지만 역대 급 최악 이 다 학부 생 들 한테 맞 지 도 않 는 실무 얘기 나 하 고 ... 절대 듣 지 말 아 셈,,,,,,,,,,,,,,
커리큘럼 없 어서 뭘 가르치 는지 잘 모르 겠 음,,,,,,,,,,,,,,
은 덤 .... 마지막 에 독후감 쓰 는 숙제 는 왜 하 아야 하 는 지도 모르 겠 고 좀 귀찮 았 습니다,,,,,,,,,,,,,,
1 은 모르 겠 는데 2 는 외국인 유학생 이랑 조 짜 여 지 어서 멘토링 10 시간 이상 하 는 것 이 에요,,,,,,,,,,,,,,
"""수업 초반 에 하 ㄹ 때 는 알 ㄴ 들 어도 괜찮 고 "," 멘토링 은 10 시간 만 딱 채우 고 더 이상 알 ㄴ 만나 도 무방""",,,,,,,,,,,,,,
그냥 부탁 하 면 교수 님 이 거절 하 ㄹ 터 이 ㄴ데 C + + 로 자료구조 를 배우 어야 하 ㄹ 이 유저 는 게임 개발 관심 있 다고 강조 하 ㅁ,,,,,,,,,,,,,,
