출 결도 2 번 봐  근데 아마 다음 학기 에 는 이러 지 않 을 것 에 요 온오 프 가 아니 ㄹ 것 이 ㅂ니다,,,,,,,,,,,,,,
로 회유 를 하 시 는 것 같 은 데 그닥 ... 그거 없 어도 뭐 ... 천 원 들 고 800 원 짜리 과자 사 먹 는데 100 원 더 주 시 ㄴ다고 그래서 과자 못 사 먹 나,,,,,,,,,,,,,,
아 물론 나 는 A + 받 기 는 하 았 는데 이것 은 뭐 수업 듣 는 학생 들 이 워낙 공부 를 안 하 아 서 그런 거라고 생각하 아 도 됌 이 과목 은 딱히 공부 를 안 하 아 도 점수 그냥 가져가 라 하 는 수업 이 ㄴ데 주위 사람 들 이 안 하 아 서 무엇 ㄴ가 하 ㄹ 얘기 는 많 은데 .. 1 점 이 ㄴ 것 보 았 으면 알 아서 거르 겠 지 뭐 그 정도 눈치 는 있 을 것 아니 겠 음,,,,,,,,,,,,,,
비율 알 ㄴ 채우 어 주 고 그냥 돈 학교 에 버리 러 가 아 다 생각 하셈,,,,,,,,,,,,,,
이후 에 출 튀하 고 남 아 있 는 인원 한 번 체크 하 았 는데 어떤 기준 으로 평가 는지 는 잘 모르 겠 음,,,,,,,,,,,,,,
' 라고 하 ㄹ 수 는 있 겠 지만 글쎄요 대학 강의 로서 얻 은 것 은 거의 없 습니다,,,,,,,,,,,,,,
결론 저 도 성적 을 잘 받 았 기에 별점 5 점 을 드리 지만 대학 에서 배우 어야 하 ㄹ 강의 이 ㄴ지 를 고려 하 아 보 ㄴ다면 이 강의 는 과 대 평가 되 었 다고 생각 하 ㅂ니다,,,,,,,,,,,,,,
교수 님 이 이 수업 재미없 을 끄 어 라고 드랍 하 어 도 되 ㄴ다고 하 시 ㄴ 이유 를 알 것 같 았 음,,,,,,,,,,,,,,
시험 배우 는 것 없 는데 시험 은 내야 하 니 진짜 이 상한 거만 나오 ㅁ,,,,,,,,,,,,,,
교육자 대 제자 보다 는 사회 에서 선후배 로 만나 면 좋 을 것 같 은 느낌 우선 교재 위주 로 진도 나가 기 때문 에 교재 를 구입 하 거나 얻 는 것 이 좋 을 것 같 습니다,,,,,,,,,,,,,,
이런 것 들 으려고 아침 에 학교 오 는 것 이 짜증 나 았 음,,,,,,,,,,,,,,
최악 이 ㅁ 저 의 발 듣 지 말 아 요 진짜 .... 수업 에 체계 가 없 어서 이것 하 았 다 저거 하 았 다 정신 없 고 교수 님 자체 가 잘 모르 아서 설명 잘못 하 았 다 가 정정하 .... 편애 심하 ㅁ,,,,,,,,,,,,,,
재수강 하 라고 학점 아예 내리 어 주 시 ㄴ 것 같 은 데 재수강 안 하 고 그냥 가지 어 가 ㅂ니다,,,,,,,,,,,,,,
가르치 는 것 은 괜찮 을지 모르 아도 진짜 시험 이나 평가 방식 이 개 쓰레기 니까 ㄴ,,,,,,,,,,,,,,
신시 때 배우 ㄴ 내 영 다시 보 시 고 공식 같 은 것 은 다 외우 어 가 시 는 것 이 시험 나 ㄹ 멘탈 에 이롭 습니다,,,,,,,,,,,,,,
아니 왜 강의 력 이 좋 은 것 도 아니 고 친절 하 ㄴ 것 도 아니 ㄴ데 학점 은 왜 이렇게 비율 도 알 ㄴ 채우 어 주 ㅁ,,,,,,,,,,,,,,
수업 제대로 듣 은 것 이 하 ㄴ 번 도 안 되 네 여 맨날 웅얼거리 시 어서 마이크 가 무슨 기능 하 는 지 모르 겠 구 배우 는 것 랑 시험 문제 랑 딴판 이 어서 공부 하 는 보람 이 없 는 느낌 이 랄까 암튼 별로 이번 에 는 학점 도 알 ㄴ 채우 어 주 어서 더더욱 별로,,,,,,,,,,,,,,
개씹 별 로 무슨 성적 확인 하 러 가 면 무조건 따지 는 줄 알 고 대화 다 잘라먹 고 가르치 는 것 도 없 으니까 그냥 대화 에서 이기 기 ,,,,,,,,,,,,,,
수업 내용 은 관련 전공 으로 진로 계획 중 이 면 괜찮 을 수 도 있 지만 시험 이랑 관계 없 는 내용 이 태반 이 며 의미 가 없 습니다,,,,,,,,,,,,,,
뭐 제대로 가르치 지 도 않 고 프로젝트 나 시키 고 시험 은 헬 파티 열리 고 악마 들 이 꽹 과 리 치 는 수준 게다가 수업 도 못하 고 이해 도 못하 겠 다,,,,,,,,,,,,,,
흠 ... 남 는 것 없 고 교수 님 이 뭘 가르치 고 싶 은지 잘 모르 겠 음,,,,,,,,,,,,,,
얻 어 가 는 것 이 많 은 수업 발표 랑 질문 이랑 열심히 하 았 고 나름 발표 에 대하 ㄴ 칭찬 도 받 았 다고 생각하 아 서 적어도 A 0 기 는데 기대 보다 는 점수 를 안 주 심 그래도 매주 숙제 하 는 것 빼 면 시험 도 없 고 좋 은 수업,,,,,,,,,,,,,,
숙제 가 이 주 에 한 번 이 라 괜찮 기 는 한데 그래도 다시 들 으라 하 면 듣 고 싶 지 는 않 은 강의 ..... 몇십 명 앞 에서 나 의 발표 가 나노 단위 로 평가 되 는 것 이 무섭 다면 이 과목 은 패스,,,,,,,,,,,,,,
글 을 숙제 떼우 는 식 으로 대충 쓰 지 않 고 진짜 고민하 많이 찾아보 고 생각하 아 서 쓰 시 면 학점 은 잘 나오 ㅂ니다,,,,,,,,,,,,,,
스피치 보다 는 글 쓰 는 것 을 집중 하 아서 가르치 어 주 시 고 그마 저 도 수업 보다 는 발표 듣 고 질문 이 더 많 아서 배우 ㄴ 것 이 생각 보다 없 는 것 같 은 느낌 이 들 ㄴ다,,,,,,,,,,,,,,
수업 진행 은 다른 강의 평 에 많 아서 안 쓰 겠 습니다,,,,,,,,,,,,,,
"""이 때 전 교수 님 이 말 하 시 ㄴ 참신 하 ㄴ 글 을 쓰 고 싶 어서 근거 "," 핵심 메세지 선정 부터 고민 을 많이 하 다가 오히려 항상 글 은 급하 게 쓰 었 는데 이것 이 성적 을 잘 받 는 데 는 별로 이 ㄴ 것 같 더라구요""",,,,,,,,,,,,,,
"""교양 수업 같 은 경우 "," 다양 하 ㄴ 전공 학생 들 이 모이 어 얕 은 지식 을 하 나 얻 어 가 는 수업 이 ㅂ니다""",,,,,,,,,,,,,,
"""재미 없 고 ", 귀찮 고 , 빡 세 고 , 피곤 하고 , 지루 하고 , 유익 하 지 도 않 고 , 질적 으로 도 별로 고 , 학점 따 기 힘들 고 ," 평가 기준 마저 제멋대로 이 ㄴ 강의 이 었 음""",,,,,,,,,,,,,,
"""교수 님 께서 인성 이 나쁘 시 ㄴ 분 은 아니 ㄴ지라 이 정도 로 악평 을 쏟 아 내 고 싶 지 ㄴ 않 았 지만 "," 그 와 는 별개 로 누구 ㄴ 가 가 나 에게 이 강의 에 대하 어 묻 으시 면 절대로 듣 지 말 라고 하 ㄹ 것 이 ㅁ""",,,,,,,,,,,,,,
글쎄 ... 평이 좋 아서 기대 하고 들 었 던 수업 이 ㄴ데 ' 글쎄 ' 같 은 수업 이 ㅁ,,,,,,,,,,,,,,
이것 이 말투 이 ㄴ지 는 모르 아도 짜증 내 듯이 말 하 는 화법 이 라 그냥 매 수업 마다 교수 님 짜증 받 아 주 러 가 는 것 같 았 음,,,,,,,,,,,,,,
"""말 을 잘하 거나 발표 하 ㄹ 때 스킬 을 가르치 어 주 는 것 은 거의 전혀 없 으며 ", 글 을 쓸 때 어떻하 게 하 면 창의적 으로 , 남 들 과 는 다르 게 ," 논리적 으로 작성 하 는지 를 주로 가르치 어 주 시 ㅂ니다""",,,,,,,,,,,,,,
교수 님 이 하 라는 것 신경 쓰 어서 열심히 하 고 적극적 으로 수업 참여 하 시 ㄴ다면 얻 어 가 는 것 도 많 고 공부 하 는 것 없이 학점 도 쉽 게 받 을 수 있 습니다,,,,,,,,,,,,,,
나 는 이제 까지 듣 은 과목 중 에 제일 인생 에 도움 되 는 것 같 았 다,,,,,,,,,,,,,,
플젝  진짜 2 주 우 동안 열심히 하 았 는데 시간 과 노력 대비,,,,,,,,,,,,,,
쓰레기 수업 절대 듣 지 말 아 셈 진심 이런 노답 교수 는 처음 보 ㅁ,,,,,,,,,,,,,,
출장 가 ㄴ다고 수업 빨리 끝나 거나 수업 늦 게 오 는 일 많 음,,,,,,,,,,,,,,
달 원 찡 재미있 고 강의 잘 가르침 1 학년 들 은 들 어 두 면 미 시 나 거시 공부 하 ㄹ 때 많이 도움 되 ㄹ 것 이 다,,,,,,,,,,,,,,
경제 원론 과 함께 가장 기초 가 되 는 학문 은 맞 지만 신입 생 들 한테 는 어렵 ㄹ 수 밖에 없 는 과목 .. 특히 나 교수 님 께서 아직 탑재 안 되 ㄴ 지식 에 대하 아서 도 학생 들 이 알 고 있 다고 생각 하 시 고 강의 를 진행 하 시 니 심도 있 는 복습 이 필요 하 ㅁ,,,,,,,,,,,,,,
이번 에 코로 나라 서 그리하 었 는지 학점 개 잘 주 ㅁ,,,,,,,,,,,,,,
하 ㄹ 정도 는 아니 ㄴ데 수업 시간 에 배우 ㄴ 기억 이 안 날 ㅂ니다,,,,,,,,,,,,,,
어렵 고 진짜 1 학년 은 안 듣 는 것 추천 이 요 ...,,,,,,,,,,,,,,
솔직히 얘기 하 아서 이번 1 학년 들 고등학교 에서 행렬 을 배우 지 않 고 올라오 았 더군요,,,,,,,,,,,,,,
나 도 그렇게 만족 스럽 ㄴ 수업 은 아니 었 지만 밑 에 + 알 ㄴ 채우 어 주 ㄴ다고 찡찡거리 는 새끼 보고 쓰 ㄴ 다 +  맞 고 싶 으면 그 정도 공부 를 해라 그냥 달 라고 찡찡 대지 말 고,,,,,,,,,,,,,,
진짜 + 알 ㄴ 채우 어 주 고 뭘 배우 ㄴ 것 이 ㄴ지 모르 겟 음,,,,,,,,,,,,,,
목소리 되게 작 다가 갑자기 엄청 크 게 기 침하 시 고 아무 일 없 다는 듯 수업 하 시 는데 .. 귀 가 이 파 았 고 진짜 얻 어 가 는 것 이 없 는 수업 그렇 다고 꿀 도 아니 ㄴ 음 등록금 조금 아깝 다고 생각하 ㄹ 수 있 는 수업 이 ㅂ니다,,,,,,,,,,,,,,
이번 학기 부터 안 하 시 ㄴ 다니 좋 고 듣기 안 좋 은 농담 을 하 아서 기분 이 나 쁩 니 다 시험 나오 는 것 은 다 표시 하 아 주 시 고 흘리 듯 말 하 시 ㄴ 거도 몇 개 말 하 시 는데 A 맞 으려면 그거 도 외우 어야 하 ㅂ니다 다 들 엄청 잘 맞추 시 어서 ...,,,,,,,,,,,,,,
컴 학 최악 의 수업 탑 3 안 에 들 는 것 같 음,,,,,,,,,,,,,,
두려움 갖 지 말 고 새롭 ㄴ 지식 배우 ㄴ 단 생각 으로 열심히 하 면 잘나 오 ㅁ,,,,,,,,,,,,,,
교수 도 조교 도 학생 이나 수업 에 1 도 관심 없 습니다,,,,,,,,,,,,,,
웹 은 그냥 혼자 집 에서 독학 하 기 ㄹ .. 학점 안 줌 배우 는 것 도 없 고,,,,,,,,,,,,,,
수업 이 어떻 고 저쩌 고 를 떠나 서 이 교수 가 지식 이 있 는 것 이 ㄴ지 아니 면 함께 배우 러 온건 지 .. 잘 모르 겠 고 갑자기 오류 가 뜨 면 같이 구글 링 을 하 아 보 ㄹ까요,,,,,,,,,,,,,,
살 면서 교육 받 는 동안 최악 의 교수 님 을 만나 았 습니다,,,,,,,,,,,,,,
진짜 강의 펑 안 쓰 는데 학교 6 년 다니 ㄴ 화석 으로 사상 최악 의 교수 여서 쓰 ㄴ다,,,,,,,,,,,,,,
하지만 여기 서 허 언 이 또 도지 어서 1 월 1 일 저녁 8 시 현재 까지 가 성적 입력 되 어 있 다,,,,,,,,,,,,,,
강의 를 듣 을 교수 님 을 선택 하 는 것 은 자유 지만 부디 자신 에게 도움 이 되 는 쓰 ㄴ 말 과 근거 없 는 잔소리 는 구분 하 시 기 ㄹ 바라 ㅂ니다,,,,,,,,,,,,,,
A 를 못 받 은 것 은 자랑 은 아니 지만 중점 은 A 를 못 받 았 어도 전혀 후회 가 없 다는 것 이 고 교수 님 강의 를 듣 은 것 을 다행 으로 여기 고 있 다는 것 이 ㅂ니다,,,,,,,,,,,,,,
보 면 일 상생 활 에서 디스플레이 를 많이 접하 니 꽤 나 재미있 는 과목 이 ㅂ니다,,,,,,,,,,,,,,
또한 교수 님 께서 전문가 이상 으로 많 은 지식 을 갖추 고 계시 고  또한 훌륭 하 아서 많 은 지식 을 얻 어 가 ㄹ 수 있 음,,,,,,,,,,,,,,
시험 2 번 이 고 내용 도 그렇게 안 어렵 어 서 개 꿀 인 거 같 기 는 한데,,,,,,,,,,,,,,
이 수업 에서 디스플레이 에 대하 ㄴ 전반적 이 ㄴ 이해 를 얻 어 가 ㄹ 수 있 다,,,,,,,,,,,,,,
그러나 당신 이 학점 에 대하 어 신경 을 쓰 는 편 이 라면 이 수업 은 거르 기 ㄹ 추천 하 ㄴ다,,,,,,,,,,,,,,
"""1 교수 님 의 열정 에 비례 하 지 않 은  ", ," 진짜 무슨 소리 이 ㄴ지 하나 도 모르 겠 습니다""",,,,,,,,,,,,,,
좋 은 학점 보다 많 은 것 을 배워가 고 싶 은 학우 들 에게 는 추천 하 지 않 습니다,,,,,,,,,,,,,,
디스플레이 에 진짜 관심 이 많 아서 깊 게 공부 하고 싶 다면 이 수업 은 진짜 맞 지 않 을 것 같 습니다,,,,,,,,,,,,,,
전기 과 에 디스플레이 트랙 을 타 기 위하 아 일부러 관련 교과목 을 듣 는 사람 들 은 거의 없 지만 만약 에 디스플레이 트랙 을 타 고 싶 다면 꼭 들 으시 어요,,,,,,,,,,,,,,
강의 듣 는 내내 많이 힘들 었 지만 마음 만 은 착하 시 고 저 는 결론적 으로 성적 이 잘 나오 아서 이 럴 지 ㄴ 모르 지만 하 ㄴ 학기 동안 그래도 이 디스플레이 과목 중 에 가장 난이도 가 쉽 ㄴ 반 이 었 던 것 같 습니다,,,,,,,,,,,,,,
무슨 말 하 는지 1 도 못 알 아 듣 었 네요,,,,,,,,,,,,,,
2019 년도 2 학기 기준 으로 는 공식 을 외우 어야 하 ㄹ 필요 는 없 었 습니다,,,,,,,,,,,,,,
교수 님 조교 님 다 착하 시 고 이 ㄴ 강 은 도움 되 고 재미있 는 네트워크 내용 이 많 음,,,,,,,,,,,,,,
교수 님 이 정보 통계 도 듣 는 수업 이 ㄴ 것 엄청 신경 을 쓰 시 어서 정보 통계 도 수강 하 아도 나쁘 지 않 음,,,,,,,,,,,,,,
중국어 로 가르치 시 는 것 이 뿐 만 아니 라 교수 님 낫 다,,,,,,,,,,,,,,
카메라 셔터 소리 에 반응하 창 지 ㄴ 좌 의 끼 를 모르 아 보 는 이 가 없 기 ㄹ 바라 ㄴ다,,,,,,,,,,,,,,
왜 에 타 아 는 0 점 이 없 는지 모르 겠 다,,,,,,,,,,,,,,
자기 가 내 ㄴ 중간 채점 이 잘못 되 어 있 어도 ’ 나 는 모르 ㄴ다 조교 한테 따지 어 라 ’ 뭐 만 하 면 조교 조교 나 는 모르 아 날 ㄴ 모르 아 하 ㄴ 대 주 어 패 버리 고 싶 다,,,,,,,,,,,,,,
꼼수 가 없 고 군더더기 없 는 시험 이 에요,,,,,,,,,,,,,,
배우 는 것 은 없 지만 학점 받 기 아주 쉽 ㄴ 강의 같 습니다,,,,,,,,,,,,,,
해당 과목 이 기초 역량 교 양 에 속하 기 때문 에 졸업 요건 을 채우 ㄹ 수 있 는 교양 에 하 아 당 하 ㅂ니다,,,,,,,,,,,,,,
"""어떤 곳 이 창의적 환경 이 ㄴ지 를 주변 에서 찾아보 고 ", 창의적 이 라고 생각 하 는 이 유 근거 를 생각 하 기 ' 효과적 이 ㄴ 학습 전략 ' 은 무엇 이 ㄴ지 , 나 가 사용 하 는 학습 전략 은 무엇 인지 에 대하 여 생각 하 기 어떤 사람 이 창의적 이 ㄴ 리더 라고 생각 하 는지 ," 나 가 닮 고 싶 은 창의적 이 ㄴ 리더 는 누구 이 ㄴ지 를 이 유 근거 와 함께 생각 하 기 강제 결합 법 을 활용 하 아 자신 만 의 창의적 아이디어 산출물 만들 기 창의적 사고기 법 을 활용 하 ㄴ 자신 만 의 창의적 아이디어 상품 개발 하 기 자신 만 의 창의적 이 ㄴ 명함 만들 기 등 의 숙제 를 수행 하 시 어서 워드 파일로 숙제 제출 하 는 것 이 19""",,,,,,,,,,,,,,
아깝 다 강의 평가 쓰 고 있 는 이 시간 ....,,,,,,,,,,,,,,
처음 부터 끝 까지 애초 에 제대로 되 ㄴ 것 은 하나 도 없 고 뭐 배우 고 뭐 하 는 과목 인지도 모르 겠 음,,,,,,,,,,,,,,
학기 내내 문제 제기 오 지 게 받 아서 아마 담 학기 에 또 하 ㄹ 란 가 모르 겠 음,,,,,,,,,,,,,,
이번 에 는 온라인 수업 이 라 그리하 었 는지 모르 겠 지만 숙제 가 조금 많 은 편 이 라고 느끼 었 고 시간 투자 하 아야 하 는 숙제 들 이 었 다,,,,,,,,,,,,,,
"""전기 기사 나 공사 기사 의 설비 기준 에 도움 이 되 ㄹ 거라 생각 하고 ", 숙제 는 전기 관련 박람회 참여 하 아 감상문 쓰 는 것 하나 있 었 고 ," 시험 은 중간 과 기말 두 번 이 었 으며 시험 난이도 는 이 하 아 그런 것 없이 외우 면 되 는 강의 기 에 전혀 어렵 지 ㄴ 않 습니다""",,,,,,,,,,,,,,
"""특히 "," 철학 에 입문 하 ㄴ 1 학년 에게 적합 하 다고 생각 되 ㅂ니다""",,,,,,,,,,,,,,
"""나 는 시간 이 많 고 잉여 고 ", 취업 은 하 아야 되 는데 뭘 쓰 ㄹ지 모르 고 ," 안전 빵 A + 이 필요 하 다면 강추""",,,,,,,,,,,,,,
그냥 점수 잘 주 는 수업 그 이상 도 이 하도 아니 ㄴ데 쓰 자 ㄹ 데 기 없 는 숙제 가 많 았 던 기 억 이 남,,,,,,,,,,,,,,
남 는 것 도 많 고 좋 은 수업 이 지만 듣 을 때 는 전공 에 영향 을 미치 기 때문 에 시간표 널 널 하 ㄴ 사람 들 듣 는 것 추천,,,,,,,,,,,,,,
.. 귀찮 지만 ... 배우 ㄹ 것 엄청 많 고 학점 A + 로 다 채우 어 주심 짱짱,,,,,,,,,,,,,,
학기 말 가 면 바쁘 다는 핑계 로 흐지부지 아무것 도 안 하고 대충 대충 하 ㅂ니다,,,,,,,,,,,,,,
숙제 자잘 하 ㄴ 것 많 고 팀 모임 도 많 은 축 이 지만 시험 안 보 고 A + 받 는 3 학점 강의 라고 생각 하 면 감지덕지,,,,,,,,,,,,,,
이런 교수 님 들 만 있 었 으면 진짜 학점 다 전공 으로 채우 어 들 었 을 것 같 음,,,,,,,,,,,,,,
근데 또 내용 좋 으면 굳이 퍼포먼스 화려 하 지 않 아도 상관 없 는 것 같 고 .. 그냥 이런 식 으로 진행 되 ㄴ 단 것,,,,,,,,,,,,,,
나 가 발표 하 았 을 당시 모든 조 들 이 거의 다 잘 하 아서 이것 으로 특별 하 ㄴ 변별력 은 없 었 던 것 같 음,,,,,,,,,,,,,,
배우 었 는지 도 모르 았 던 내용 들 이 이제 서 야 자리 잡아가 는 느낌 을 받 았 음,,,,,,,,,,,,,,
숙제 안 가르치 어 주 고 내 는 것 은 사실 이 교수 님 말 고 도 많 은 컴 학 교수 님 들 이 그렇게 하 시 ㅂ니다,,,,,,,,,,,,,,
강의 스타일 은 현대 OS 에 대하 아서 강의 하 는 식 이 라 교재 에서 산 으로 가 ㄹ 때가 많 았 는데 오히려 이런 점 이 유익 하 았 다,,,,,,,,,,,,,,
밑 에 컴퓨터 학부 아니 면 그냥 듣 지 말 아라 셈 타 아 학과 들 자신 없 으면 복 전도 하 지 말 던 가 별점 테러 하고 가 네,,,,,,,,,,,,,,
저 가 알 기 로 ㄴ 저희 학부 생 중 에 는 그런 사람 이 없 는데 어디 숨 어 계시 나요,,,,,,,,,,,,,,
뭘 가르치 고 숙제 를 내 던가 컴퓨터 학부 는 원래 안 가르치 고 하 아야 하 는 것 라며 이 것 다 가르치 고 숙제 내 려면 1 년 넘 게 하 아야 하 ㄴ다고 .. 그냥 하 ㄴ 학기 짜리 에 맞 게 가르치 ㄹ 생각 은 안 하 고 졸업 생 을 다 OS 기본 소양 을 갖추 게 만들 생각 이 ㄴ 것 이 ㄴ가 시대 에 뒤 떨어지 ㄴ 사고 방식 이 ㅁ,,,,,,,,,,,,,,
"""족 보 없 으면 뒤쳐지 ㄹ 수 밖에 없 는 과목 "," 숙제 는 틈틈히 나오 지만 생각 말 ㄴ 있 다면 충분히 풀 수 있 다""",,,,,,,,,,,,,,
제일 빡 세 었 던 수업 이찬호 교수 님 은 수업 하나 듣 는 것 이 다른 수업 두 개 듣 는 느낌 이 니 참 고,,,,,,,,,,,,,,
숙제 는 쉽 었 고 한 번 은 도저히 모르 겠 어서 별 찍 는 문제 PRINTF 노 가 다 코딩 하 는 수준 으로 와 꾸 만 맞추 어서 내 었 는데 말 ㄴ 점 받 음,,,,,,,,,,,,,,
홍 수업 을 알 ㄴ 듣 어 보 아서 모르 겠 는데 이 교수 님 수업 이 비교 하 았 을 때 많이 밀리 ㄹ 것 라고 는 생각 안 하 ㅁ,,,,,,,,,,,,,,
5 코딩 은 자신 없 고 필수 라 듣 어야 겠 는 학생 들 에게 ㄴ 꿀 강일 듯,,,,,,,,,,,,,,
4 년 강의 통틀어 가장 많 은 것 을 배우 ㄴ 수업,,,,,,,,,,,,,,
일단 배우 ㄹ 것 이 많 은 수업 이나 1 학점 치고 는 헤비 하 았 던 과목 ... 거의 5 학점 짜리 수업 ...,,,,,,,,,,,,,,
암튼 하 ㄴ 학기 동안 힘들 었 지만 얻 어 가 아 는 것 은 많 은 과목,,,,,,,,,,,,,,
.. 15 전정공 수업 과 18 스시 소 수업 을 둘 다 들 었 다는 것 은 말 이 안 되 는 것 같 은 데 ... 이 두 수업 에 연달 아 우호적 이 ㄴ 내용 이 비슷 하 ㄴ 말투 로 달리 ㄴ다는 것 은 의심 스럽 네요,,,,,,,,,,,,,,
듣 지 말 아 제발 ... 제발 .... 제발 ...... 무슨 심보 로 그러 는 지 이 교수 님 좋 다고 수강 평 남기 는 학우 도 몇 있 던데 .. 왜 그러 고 사 냐,,,,,,,,,,,,,,
교수 님 이 수업 진도 보다 는 개인적 이 ㄴ 얘기 많이 하 시 고 그것 이 나름 재미 는 있 지만 기 말 때 되 면 뭘 배우 었 는지 하나 도 남 는 것 이 없 음,,,,,,,,,,,,,,
주관식 3 문제 도 나오 는데 그 문제 에 답 을 쓰 어도 좋 지만 그 문제 의 답 뿐 만 아니 라 자신 이 이번 에 시험 을 보 기 위하 아 얼마나 많 은 암기 를 하 았 는지 서술 형 문제지 에다가 많이 쓰 면 쓰 ㄹ수록 좋 게 주심,,,,,,,,,,,,,,
빡 세 기 는 한데 남 들 도 다 빡 세 서 예상 보다 성적 이 괜찮 고 무엇 ㄴ가 배워가 는 느낌 이 나 서 좋 았 음,,,,,,,,,,,,,,
수업 도 쉽 고 다 좋 은데 시험 이 1 번 이 ㄴ데 60 라 그 날 몸 상태 가 안 좋 다 든가 하 아서 망치 면 1 학기 가 날아가 ㄴ다,,,,,,,,,,,,,,
"""성적 다 채우 어 주 시 고 "," 배우 는 것 많 은 수업""",,,,,,,,,,,,,,
그런데 수업 하나하나 가 배우 ㄹ 내용 이 많 아서 그냥 결석 안 하 는 것 을 추천 ... 괜히 한 번 결석 하 았 다 가 못 따라가 ㄹ 수 가 있 음,,,,,,,,,,,,,,
알 는 사람 중 에 기업 의 임원 이 있 으면 그 사람 찾아가 서 인터뷰 하 는 것 이 잘못 은 아니 라 고 생각 하 는데 ... 전혀 모르 는 사람 을 인터뷰 한 조가 있 다면서 근거 를 대 실 때 해당 학생 이 모르 는 사람 을 인터 뷰 하 았 는지 거짓말 을 하 았 는지 구분 이 안 가 는 상황 이 연출 되 ㅂ니다,,,,,,,,,,,,,,
"""그래도 도움 이 많이 되 는 강의 이 었 고 "," 학생 들 의 참여 를 계속 이 끌어내 시 고 꽤 나 학생 들 도 적극적 으로 수업 시간 에 참여 하 아서 대학 생활 중 한 번 은 듣 어 보 ㄹ 만 하 ㄴ 강의 이 ㄴ 것 같 습니다""",,,,,,,,,,,,,,
.. 학생 에게 그닥 관심 이 없 으시 ㄴ 것 같 지만 또 그것 ㄴ 아니 ㄴ 것 같 기 도 하 고 .... 여 트 ㄴ 결론 은 교수 님 귀엽 습 ㅂ니다,,,,,,,,,,,,,,
남녀 대화 차이 라고 10 년도 더 되 ㄴ 다큐 가지 고 수업 하 는 것 이 말 이 되 ㄴ다고 생각 하 는지 지금 이 무슨 시 대 ㄴ 데 남자 어 여자 어 이런 거르 ㄹ 수업 에서 가르침,,,,,,,,,,,,,,
대학 생 교양 으로 쉽 고 맞춤법 보 기 는 잘 안 쓰 는 것 이 많이 나오 아서 실생활 에 도움 이 안 되 ㅁ,,,,,,,,,,,,,,
유용 하 ㄴ 맞춤법 국어 규정 같 은 것 을 알리 어 주 시 었 으나 대학생 교양 으로 는 쉽 지 않 았 나 싶 음,,,,,,,,,,,,,,
수업 준비 도 완벽 하 게 하 아 오 시 고 불편 하 ㄴ 것 하나 도 없이 수업 내용 이 나 한테 도움 이 많이 되 었 고 대학 에 오 아서 3 년 동안 듣 은 수업 중 에서 가장 듣 을 만 하 ㄴ 수업 이 었 다,,,,,,,,,,,,,,
"""비 폭력 대화 나 "," 감정 코칭 등 의사소통 에 관련 되 ㄴ 전반적 이 ㄴ 스킬 들 에 대하 아서 배우 ㄹ 수 있 어서 좋 았 음""",,,,,,,,,,,,,,
"""가성 비 좋 은 강의 .. 다만 ' 의사소통 기법 ' 이 라고 하 아서 실생활 에서 유용 하 ㄴ 정보 등 을 배우 는 강의 는 아니 고 ", 읽기 자료 등 보 면서 의사소통 의 개념 과 ' 방법론 ' ," 상대방 을 이해 하고 공감 하 는 것 에 대하 어 배우 는 강의 이 ㅂ니다""",,,,,,,,,,,,,,
"""그냥 공부 제일 열심히 하 았 던 강의 지만 "," 제일 점수 못 얻 어 가 ㄴ 강의 이 ㅁ""",,,,,,,,,,,,,,
... 또한 시험 에 대하 ㄴ 구체적 이 고 객관적 이 ㄴ 기준 이 없 는 것 같 다고 느끼 었 습니다,,,,,,,,,,,,,,
조원 들 이랑 토의 한 것 말 하 라고 시키 는 데 이것 는 부담 느끼 ㄹ 만 하 ㄴ 것 은 절대 아니 구,,,,,,,,,,,,,,
연극 을 하 아야 하 는 것 이 색다르 고 재미있 기 는 하 았 다 만 성의 없 는 팀 이 나오 ㄹ 때 ㄴ 수업 시간 이 아깝 었 어요,,,,,,,,,,,,,,
... 의사소통 잘하 려면 당연히 남 의 말 잘 듣 고 예의 갖추 어 말 하 고 ... 이런 것 처럼 나 도 당연 하 ㄴ 얘기 들 을 수업 으로 하 시 려니 교수 님 도 고역 이 ㄹ 듯 싶 어요,,,,,,,,,,,,,,
가르치 시 는 것 없이 발표 하나 로 끝 내 ㅂ니다,,,,,,,,,,,,,,
"""코로나 때문 이 ㄴ지 원래 그리하 었 는지 ", 주 1 회 1 숙 제 필수 , 동영상 강의 수강 후 줌 으로 화상 수업 + 팀 프로젝트 1 시간 이상 ," 시험 오픈 북 이 라 오히려 문제 개 빡 셈""",,,,,,,,,,,,,,
이만 하 ㄴ 꿀 강의 없 음,,,,,,,,,,,,,,
"""수업 을 듣 는 내내 교수 로부터 존중 받 는다는 느낌 이 들 었 고 "," 진정 하 ㄴ 대학교 수업 이 라고 하 는 것 이 이런 거구 나 이 라는 생각 이 많이 들 는 수업 이 었 습니다""",,,,,,,,,,,,,,
"""교수 님 께서 강의 력 도 좋 으 시 지만 "," 무엇 보다 도 지식 이 많 고 대단 하 시 ㄴ 분 이 여서 수업 을 듣 다""",,,,,,,,,,,,,,
많 은 것 을 배우 고 시간 가 는 줄 모르 았 던 수업 이 었 습니다,,,,,,,,,,,,,,
다만 온오 프 수업 이 ㄴ 것 이 아쉽 었 음,,,,,,,,,,,,,,
"""", , , ," 배우 는 것 은 귀엽 지 않 지만 교수 님 이 귀 여우 시 ㄴ 것 만 으로 도 힐링 이 되 니까 귀엽 ㄴ 교수 님 좋아하 시 면 꼭 듣 어 보 시 어요""",,,,,,,,,,,,,,
"""주변 보 면 다 들 평균 만 넘 었 으면 절대평가 라 A 는 받 았 던 듯 .. 강사 분 이 시 어서 다음 에 도 오 시 ㄹ 지 ㄴ 모르 겠 지만 "," 혹시나 오 시 ㄴ다면 수강 추천 BB 친절 하고 꼼꼼 하 시 어서 수업 들 을 맛 나 았 음""",,,,,,,,,,,,,,
자연 로그 상수 가 무엇 이 ㄴ지 모르 는 분 이 계시 다면 한 시 라도 빠르 게 드랍  걸 추천,,,,,,,,,,,,,,
또한 수업 영상 이 하 ㄴ 강의 에 20 여기 서 설명도 귀 에 쏙쏙 박히 게 하 아 주 시 어서 좋 은 학점 도 챙기 고 공부 하 ㄹ 때 도 도움 이 많이 되 었 던 것 같 습니다,,,,,,,,,,,,,,
물리 와 화학 의 굴레 에서 빛 이 되 어 주 ㄴ 수학 과목 이 ㅂ니다,,,,,,,,,,,,,,
