....... 많이 배워가 여 ...,,,,,,,,,,,,,,
학기 중 에 크 ㄴ 부담 을 지우 는 수업 은 아니 지만 그냥 그래요 쏘 쏘,,,,,,,,,,,,,,
나 는 이 수업 되게 괜찮 았 는데 왜 하 게 뭐 라 하 는지 이해 가 안 가 네,,,,,,,,,,,,,,
근데 이것 가지 고 뭐 라 하 는 애 들 은 공부 안 하 아 놓 고 학점 안 나오 았 다고 빼액 하 는 거로 밖 에 이해 안 되 어 ...,,,,,,,,,,,,,,
.. 그렇 다고 막 수업 못 듣 을 정도 는 아니 ㅁ,,,,,,,,,,,,,,
목소리 크기 문제 가 아니 라 발음 문제 여서 .. 시험 문제 는 객관식 OX 단답 형 혼합 이 고 객관식 에 모두 고르 시오 와 답 없 음,,,,,,,,,,,,,,
이 있 는데 정작 나 가 답 이 없 음,,,,,,,,,,,,,,
단점 출석 안 부르 시 ㄹ 때 가 많 음,,,,,,,,,,,,,,
뭐 라고 하 는지 엄청나 ㄴ 집중력 을 가지 고 꼼꼼이 듣 어야 하 ㅁ,,,,,,,,,,,,,,
중요 하 다고 하 는 것 하나 도 안 나오 ㅁ,,,,,,,,,,,,,,
왜 까 이 는지 ... 강의 어렵 지 않 고 국제 마케팅 관점 에서 시험 이 나오 았 다고 생각 하 ㅂ니다,,,,,,,,,,,,,,
교수 님 이 출석 을 수업 끝내 ㄹ 때 부르 어서 수업 거의 끝나 가 ㄹ 때 쯤 에 오 는 학생 들 많 았 음,,,,,,,,,,,,,,
수업 은 별로 이 었 지만 A + 받 았 기에 평점 3 ..,,,,,,,,,,,,,,
개인적 으로 는 국어학 쪽 에 흥미 가 없 었 는데 의 외로 재미있 고 얻 어 가 ㄹ 것 이 많 은 수업 이 었 어요,,,,,,,,,,,,,,
"""일상생활 에서 사람 들 이 어떻하 게 대화 하고 소통 하 는지 를 언어적 이론적 으로 접근 해보 는 수업 이 ㄴ데 "," 내용 이 참 많 고 빡 세 기 는 하 어 도 곰곰이 생각하 아 보 ㄹ 지점 들 이 많 아서 좋 았 습니다""",,,,,,,,,,,,,,
학문 이나 사람 을 대하 는 마인드 도 배우 ㄹ 수 있 어서 좋 았 습니다,,,,,,,,,,,,,,
이 과목 듣 다가 대통령 꾸 을 꾸 게 되 었 습니다,,,,,,,,,,,,,,
수업 시간 때 자기 가 국가 에서 하 았 던 일 들 이나 수업 하 았 던 것 자랑 엄청 하 시 ㅁ,,,,,,,,,,,,,,
딱 꼰대 교수 탑 1 위 가 이 교수 님 이 에요,,,,,,,,,,,,,,
여기 서 뭘 배우 었 는지 확실히 남 는 것 이 있 음,,,,,,,,,,,,,,
"""학점 만 대충 받 으려고 듣 는 사람 한테 ㄴ 그냥 고통 만 남지 만 "," 열심히 열정 있 는 사람 은 고통 + 지식 을 함께 얻 음""",,,,,,,,,,,,,,
그러 니 포괄적 으로 공부 하 면 쓸 것 이 없 어 지 고 지엽적 으로 하 어 도 안 나오 면 땡 이 니 결국 은 크 게 훑 고 중요 하 다는 부분 을 세세 하 게 공부 하 면 되 ㅁ,,,,,,,,,,,,,,
.. 수업 스타일 도 별로 안 맞 는 듯,,,,,,,,,,,,,,
나 한테 다시 들 으라고 하 ㄴ다면 절대 알 ㄴ 들 음,,,,,,,,,,,,,,
배우 ㄴ 것 외우 어서 잘 쓰 면 되 는데 그것 이 어려움,,,,,,,,,,,,,,
하 ...... 이것 은 .. 뭐 랄까 ... 하 ..,,,,,,,,,,,,,,
그래도 편하 게 듣기 에 좋 았 으니 별점 3 점 짜리 강의 가 되 겠 음,,,,,,,,,,,,,,
실속 하나 도 없 고 강의 력 도 없 고 그냥 자 기 자랑 만 겁나 하 고 학생 들 의견 수렴 이 라고 ㄴ 없 는 전형적 이 ㄴ 꼰대 이 ㅁ,,,,,,,,,,,,,,
시작 은 교양 수업 같 은 데 ...,,,,,,,,,,,,,,
초반 에 ㄴ 숙제 도 없 고 뭐 도 없 고 경 수업 들 으면 끝,,,,,,,,,,,,,,
교수 이 ㅁ 이 개 쿨 남 이 고 재미있 음,,,,,,,,,,,,,,
강의 도 재미있 게 하 시 고 숙제 없 고 시험 두 번,,,,,,,,,,,,,,
성적 은 후하 게 주 었 으나 그것 이 다인 과목 남 는 것 이 없 다,,,,,,,,,,,,,,
강의 하나 하나 캡 치 어 뜨 어야 하 았 음,,,,,,,,,,,,,,
저 는 공책 도 별로 안 필요 하 았 고,,,,,,,,,,,,,,
급하 게 숙제 4 개 가 생기 었 는데 아마 출석 대체 숙제 같 았 음,,,,,,,,,,,,,,
전공 내용 남 는 것 도 없 고 수업 을 안 올리 어 주 어서 짜증 나 았 지만,,,,,,,,,,,,,,
나 에게 는 극도 로 비효율 적 ..,,,,,,,,,,,,,,
번 체 자 안 외우 어 도 되 는데 외우 면 가산점 받 는 것 같 으니까 중간 때 는 외우 어 보 ㄹ 말 ㄴ 하 아요,,,,,,,,,,,,,,
중국 살 다,,,,,,,,,,,,,,
온 것 아니 면 이 수업 안 듣 는 것 추천,,,,,,,,,,,,,,
사람 생기 ㄴ 것 가지 고 뭐 라고 하 ㅁ,,,,,,,,,,,,,,
무슨 기준 으로 학점 을 주 는지 모르 겠 음,,,,,,,,,,,,,,
게다가 수업 을 듣 고 무엇 ㄴ가 배우 었 다,,,,,,,,,,,,,,
19 년도 2 학기 에 ㄴ 실험 장비 가 말썽 이 라 전반부 전력 전자 실험 은 거의 날리 었 는데 장비 들 새로 바꾸 ㄴ다는 썰 이 있 어서 기대 하 아 보 ㄹ 만 하 다,,,,,,,,,,,,,,
기 말 내용 이 파워 월드 시뮬레이션 돌리 는 것 뿐 이 라 시험 낼 만 하 ㄴ 나 의 용 은 없 는 수준 이 라 그렇 ㄹ 수 밖에 없 는 것 같 다,,,,,,,,,,,,,,
스파이 관련 영화 3 개 를 주 고 2 페이지 이상 쓰 는 것 이 숙제 이 ㅂ니다,,,,,,,,,,,,,,
재수강 돌리 어요,,,,,,,,,,,,,,
뭐야 ..... 재수강 이 안 되 자 너,,,,,,,,,,,,,,
교양 인정 도 안 되 고 일반 선택 이 라고,,,,,,,,,,,,,,
뭐 야 나 의 재수강 돌리 어요 제발 요 아오 진짜 아오,,,,,,,,,,,,,,
양이 많 기 는 한데 중간 없 고 기말 말 ㄴ 보 아서 그런 거라 이런 것 감안 하 면 별로 많 지 도 않 은 듯,,,,,,,,,,,,,,
배우 ㄹ 때 재미있 었 음,,,,,,,,,,,,,,
교수 님 최고 의 스파이 가 되 ㄹ 께요,,,,,,,,,,,,,,
싸 강 은 함부로 신청 하 는 것 아니 다,,,,,,,,,,,,,,
구 지 듣 고 싶 으시 다면 패 폐 들 으시 어요,,,,,,,,,,,,,,
학점 제일 궁 굼 하 ㄴ 수업 이 ㅁ,,,,,,,,,,,,,,
맨날 수업 내용 똑같 고 자기 주 고 싶 은 애 들 한테 만 점수 높 게 줌 수업 내내 듣기 불편 하 ㄴ 발언 들 많 음,,,,,,,,,,,,,,
신세대 문화 는 무조건 비판 하 고 부터 봄 더 이상 배우 ㄹ 것 이 없 다고 느끼 ㄴ 수업,,,,,,,,,,,,,,
교양 선택과목 이 다,,,,,,,,,,,,,,
올해 듣 은 것 중 에 가장 교양 다운 수업 이 었 어요,,,,,,,,,,,,,,
진짜 똑똑 하 시 고 강의 자체 가 도움 이 많이 되 ㅂ니다,,,,,,,,,,,,,,
그리고 생각 보다 영어 잘 하 시 는 분 별로 없 으 시 지레 겁 먹 으시 ㄹ 필요 없 는 것 같 아요,,,,,,,,,,,,,,
영어 듣기 실력 이 하 ㄴ 학기 이 강의 듣 는다고 늘 지 는 않 지만 그래도 약간 의 도움 은 되 었 습니다,,,,,,,,,,,,,,
하지만 교수 님 이 모든 숙제 와 시험 에 채점 결과 를 바로바로 알리 어 주 시 어서 성적 에 불만 가 지 는 일 은 없 을 것 같 네요,,,,,,,,,,,,,,
두서 없이 적 었 지만 암튼 좋 았 음,,,,,,,,,,,,,,
그래도 별 2 개 주 는 이유 는 교수 님 이 나 도 착하 시 고 학생 들 을 가르치 려는 열의 가 상당 하 시 어서,,,,,,,,,,,,,,
나중 에 나 처럼 후회 하 지 말 고 제발 다른 어문 계 수업 들 어 라,,,,,,,,,,,,,,
후반부 에 난이도 가 갑자기 올라서 기초 .... 이 ㄴ 줄 알 았 던 사람 은 절대 못 따르 아 가 ㄹ 것 같 습니다,,,,,,,,,,,,,,
숙제 는 듣기 숙제 2 이 있 었 고 피드백 도 개인 별 로 다 하 아 주 시 었 습니다,,,,,,,,,,,,,,
듣기 30 단어 외우 기 40 무엇 이 ㄴ지 모르 겠 는 외국식 문법 과 음절,,,,,,,,,,,,,,
영어 듣기 의 기초 가 아니 라 영어 암기 의 기초 다,,,,,,,,,,,,,,
수업 퀄리티 를 생각 하 면 돈 아깝 ㄴ 수업 은 맞 는데 수업 하나 정도 는 여유 를 느끼 며 부담 없이 쉬 면서 듣 고 싶 다면 추천 하 ㅁ,,,,,,,,,,,,,,
배우 ㄴ 것 도 없 고 학점 도 못 얻 어 가 ㄴ 강의 .. 등록금 아깝 었 다,,,,,,,,,,,,,,
조끼 리 활동 하 는 것 도 가 벼 울 ㄴ 마음 으로 토의 하 면 되 ㄴ다,,,,,,,,,,,,,,
수업 이 답답 하고 재미없 으면 학점 이 라도 잘 받 아야 하 았 는데 고학 번 이 많 아 학점 은 압살 당하 았 다,,,,,,,,,,,,,,
숙제 없 고 수업 내용 도 쉽 ㄴ 데 에 그만큼 배워가 는 것 이 없 는 수업,,,,,,,,,,,,,,
밑 에 보 니까 나 만 재미있 었 나 싶 기 도 하 고 ..,,,,,,,,,,,,,,
시험 은 배우 ㄴ 내용 다 외우 면 되 ㅁ,,,,,,,,,,,,,,
진짜 이 것 신청 하 ㄴ 나 가 원망 스럽 다,,,,,,,,,,,,,,
전공 이 많 아 교양 공부 하 ㄹ 시간 이 없 어 선택 하 ㄴ 교양,,,,,,,,,,,,,,
리얼 공부 안 하 어 도 그냥 어느 정도 실력 있 으면 점수 받 아 가 ㄹ 수 있 음,,,,,,,,,,,,,,
꿀 이 기 ㄴ 하나 왜 앉 아서 이것 ㄹ 하 는지 매 순간순간 의 문 가득 하 아 지 ㅁ,,,,,,,,,,,,,,
1 수업 영어 실력 절대 안 늘 음,,,,,,,,,,,,,,
3 숙제 는 따로 없 음,,,,,,,,,,,,,,
그 외 에 는 그 어떤 것 도 얻 어 가 ㄹ 것 도 없 고 좋 은 것 도 없 음,,,,,,,,,,,,,,
솔직히 대학 수업 과 는 거리 가 멀 다,,,,,,,,,,,,,,
""".. 중학교 "," 고등학교 기초 내 시 ㄴ 수업 반 듣 는 느낌 과 딴 길 로 자주 새 어 버리 ㄴ다""",,,,,,,,,,,,,,
지문 하나 를 꼼꼼히 들 으니까 도움 이 되 는 것 같 아요,,,,,,,,,,,,,,
"""사실 기대 하고 듣 은 수업 은 아니 었 으나 "," 이 정도 로 별 가치 없 는 수업 일 줄 은 모르 았 음""",,,,,,,,,,,,,,
좋 았 는데 악평 이 많 네,,,,,,,,,,,,,,
진짜 쓰레기 중 에 핵 쓰레기 수업,,,,,,,,,,,,,,
4 수업 개 못 가르침 .. 그냥 지나가 던 아줌마 잡 아서 수업 하 아도 이보 다,,,,,,,,,,,,,,
5 비밀 이 쓰 자 ㄹ 데 기 없이 많 음,,,,,,,,,,,,,,
"""수업 계획표 ", 내용 ," 평가 내용 도 절대 누출 안 시키 려 잘 안 줌""",,,,,,,,,,,,,,
수업 첫날 에 도 안 알리 어 주 고 도 중 에 휴학 하 는 사람 있 을까 보 아 도 안 줌,,,,,,,,,,,,,,
왜 그러 는지 1 도 모르 겠 음,,,,,,,,,,,,,,
6 수업 도움 1 도 안 되 ㅁ,,,,,,,,,,,,,,
강사 이 ㄴ지 교수 이 ㄴ지 모르 겠 지만,,,,,,,,,,,,,,
숙제 없 고 조 모임 없 어서 꿀 이 지만,,,,,,,,,,,,,,
로 지정 좌석 에 4 이 ㄴ 조 별 로 앉히 심 부담 은 1 도 없 지만 얻 는 것 도 없 음,,,,,,,,,,,,,,
다시 한 번 말씀 드리 지만 학점 에 대하 ㄴ 가치 를 영어 실력 증진 에 대하 ㄴ 가치 보다 더 높 게 평가 하 시 ㄴ다면 최고 의 교양 이 라 생각 되 ㅂ니다,,,,,,,,,,,,,,
"""실용 중국어 표현 을 많이 배우 ㄹ 수 있 는 기회 이 었 고 "," 또 여러 중국인 친구 들 과 중국어 로 이야기 하 면서 많 은 표현 을 배우 고 어휘력 도 늘 수 있 는 좋 은 기회 이 었 음""",,,,,,,,,,,,,,
.. 차라리 돈 내 고 강남 학원 다니 는 것 이 훨 재미있 고 쉽 게 공부 하 ㄹ 수 있 었 을 듯 하 ㅁ,,,,,,,,,,,,,,
1 강의 스타일 이 올드 하 ㅁ,,,,,,,,,,,,,,
나 는 대학교 에서 언어 를 가르치 ㄹ 때 ㄴ 보다 본질적 으로 접근 하 ㄹ 줄 알 았 는데 나 가 괜하 ㄴ 망상 을 하 ㄴ 것 같 음,,,,,,,,,,,,,,
본인 이 직접 집필 하 았 는데 솔직히 학교 에서 쓰 는 거라 산거 지 이것 ㄹ 서점 에서 돈 주 고 사라 면 절대 알 ㄴ 살 ㄹ 책,,,,,,,,,,,,,,
"""3 나 는 분명 고등학교 를 졸업 하 았 는데 "," 다시 학교 를 다니 는 이 기분 은 무엇 이 ㄹ까""",,,,,,,,,,,,,,
결론 중국어 의 기초 를 다지 고 싶 다면 어학원 을 가 시 어요,,,,,,,,,,,,,,
비싸 ㄴ 학비 내 고 이런 퀄리티 의 수업 을 듣 어야 하 ㅂ니까,,,,,,,,,,,,,,
... 2 학기 는 본문 말하기 시험 보 는데 이것 이 성적 에 들어가 는지 는 잘 ... 학점 은 잘 채우 어 주 시 는 듯 하 아요,,,,,,,,,,,,,,
외우 ㄹ 것 도 많 아 오,,,,,,,,,,,,,,
이 교수 는 들 으면 겁나 후회 하 ㅂ니다,,,,,,,,,,,,,,
패턴 많이 말 하 면서 겉 으로 는 도움 되 ㄴ다고 많이 언급 하 지만 1 시간 15 분 동안 배우 는 것 이 없 습니다,,,,,,,,,,,,,,
중국어 로 돈 벌 고 있 다는 것 도 이 ㄴ지 못하 ㅁ,,,,,,,,,,,,,,
강의 퀄리티 수업 은 1 학년 대상 으로 기초 중국어 이 ㅂ니다,,,,,,,,,,,,,,
로 수업 을 다 듣 고 나 서 느끼 는 생각 은 나 가 뭘 배우 었 지,,,,,,,,,,,,,,
어쨌든 최고 이 ㅁ,,,,,,,,,,,,,,
대답 을 알 ㄴ 하 니 우리 가 알아먹 는지 못 알아먹 는지 모르 아서 그런 듯,,,,,,,,,,,,,,
UK 출신 이 라 그렇 ㄴ지 1 대 1 로 말해 보 면 실제 영어 실력 은 굉장 하 ㅁ,,,,,,,,,,,,,,
어렵 으 나 다 모르 ㅁ,,,,,,,,,,,,,,
비 대면 꿀 강의 인정 교수 님 은 좋 으시 ㅁ,,,,,,,,,,,,,,
비 대면 이 라 꿀 강의 이 었 고 절 평 아니 면 공부 하 ㄹ 것 이 많 다,,,,,,,,,,,,,,
"""다양 하 ㄴ 종교 들 을 주차 별 로 하나 씩 배우 어 요 불교 ", 기독교 , 유교 , 조로아스터교 , 도교 , 이슬람교 ," 힌두교 등 등""",,,,,,,,,,,,,,
"""이번 에 ㄴ 싸 강이 어서 나름 꿀 이 었 는데 "," 대면 시험 이 면 꿀 은 아니 ㄹ 것 같 아요""",,,,,,,,,,,,,,
교수 님 만 보 고 수강 하 는 것 도 뭐 나쁘 지 않 을 듯,,,,,,,,,,,,,,
근데 솔직히 수업 듣 어 보 ㄴ 적 없 어서 뭐 라 나 가 하 ㄹ 입장 은 아니 구,,,,,,,,,,,,,,
"""사담 이 많 으시 고 "," 비 종교인 으로서 는 집 중하 기 힘들 ㄴ 과목""",,,,,,,,,,,,,,
나름 교양 으로 배우 기 나쁘 지 않 았 어요,,,,,,,,,,,,,,
기독교 분 들 이 많 지만 그래도 열심히 하 ㄴ다면 기독교 가 아니 라서 학점 을 못 받 고 그런 것 은 없 어요,,,,,,,,,,,,,,
시험 보다 발표 비중 이 크 ㄴ 수업,,,,,,,,,,,,,,
강의 평 은 무조건 별 다섯 개 를 주 어야 하 ㄴ다느니 등 무엇 ㄴ가 나 가 짱 이야 마인드 를 가지 고 계시 ㄴ 것 같 다,,,,,,,,,,,,,,
그냥 책 낭독 하 는 수업 이 라 얻 어 가 ㄹ 수 있 는 것 이 별로 없 다고 느낌,,,,,,,,,,,,,,
책 만 달달 외우 면 되 고 수업 은 남 는 것 없 음,,,,,,,,,,,,,,
배워가 는 것 도 없 고 학점 은 채우 어 주 기 ㄴ 하 는데 비추 이 ㅁ,,,,,,,,,,,,,,
... 그냥 PPT 랑 책 에 있 는 내용 그대로 읽 고 딴 소리 도 많 고 시간 아깝 ㅁ,,,,,,,,,,,,,,
.... 배우 는 것 도 없 고 보고서 랑 발표 점수 매기 는 기준 이 무엇 이 ㄴ지 도 모르 겠 음,,,,,,,,,,,,,,
.... 글 고 딴 소리 개 많 음,,,,,,,,,,,,,,
모르 아 그냥 나 는 별로,,,,,,,,,,,,,,
이런 것 기대 하 지 말 것 강사 가 무역 전공자 도 아니 ㅁ,,,,,,,,,,,,,,
교수 가 정 교수 도 아니 고 시간 강사 도 아니 고 그냥 대졸 이 ㄴ데 무역업 계 종사자 이 ㅁ,,,,,,,,,,,,,,
비율 알 ㄴ 채우 ㅁ,,,,,,,,,,,,,,
등록금 아깝 어,,,,,,,,,,,,,,
교수 님 이 누구 가 되 었 든 대부분 한 학기 만 수업 하 는 초빙교수 무역전 시론 이 라는 수업 듣 지 말 아 ... 숙제 도 시간 에 비례 하 아서 점수 안 나오 ㅁ,,,,,,,,,,,,,,
"""아직 까지 궁금 하 ㄴ 것 은 본인 이 무역 회사 사장 이 라면서 ", 자기 옷 명품 브랜드 소개 하고 , 가격대 알리 어 주 고 , 돈 자랑 하고 , 학생 들 한테 이것 이 현실 이야 이래 놓 고 ," 왜 굳이 무역 관련 공기업 이랑 숭실대 를 비롯 하 ㄴ 수많 은 무역학 과 있 는 대학 에서 강의 하 면서 돈 버  궁금 하 ㅁ""",,,,,,,,,,,,,,
지극히 내 어 주관적 이 ㄴ 평가 이 ㅁ,,,,,,,,,,,,,,
서술 형 1 문제 이 ㄴ데 뭐 나오 ㄹ지 알리 어 주심,,,,,,,,,,,,,,
교양 다운 수업 이 ㅂ니다,,,,,,,,,,,,,,
물론 암기 도 필요 하 지만 수업 시간 에 듣 고 전체적 이 ㄴ 흐름 이나 이야기 로 기억 하 는 것 이 더 좋 은 것 같 아 요 많이 배워가 는 교양 이 ㅂ니다,,,,,,,,,,,,,,
노잼 ... 개 노잼 개개 노잼 이 ㅂ니다,,,,,,,,,,,,,,
외우 어야 대 ㅂ니다,,,,,,,,,,,,,,
조 모임 도 없 고 숙제 도 딱 한 번 사건 에 대하 아서 조사 하 는 것 밖에 없 어서 편 햐 요,,,,,,,,,,,,,,
그저 갓 .. 여태 듣 은 교양 중 에 제일 대학 같 았 습니다,,,,,,,,,,,,,,
재미있 어서 금방 집 중하 게 되 ㅂ니다,,,,,,,,,,,,,,
꿀 강 은 절대 아니 ㅁ,,,,,,,,,,,,,,
그런데 이런 것 이 배우 는 거구 나 라고 느끼 ㄹ 정도 로 좋 은 강의,,,,,,,,,,,,,,
사실 왜 배우 는지 는 잘 모르 겠 는,,,,,,,,,,,,,,
하지만 내용 이 재미있 고 한 번 도 배우 어 본 적 없 는 내용 이 라서 흥미 롭 게 듣 은 것 같 네요,,,,,,,,,,,,,,
하 ㄴ 학기 동안 좋 은 수업 듣 은 것 같 습니다,,,,,,,,,,,,,,
말 그대로 흥미 로 울 ㄴ 교양 을 배우 는 느낌,,,,,,,,,,,,,,
대학 생활 4 년 중 최고 의 강의 라고 생각 하 ㅁ,,,,,,,,,,,,,,
지금껏 들어오 았 던 그 많 은 전공 교양 강의 에서 기억나 는 것 합치 어도 이 강의 에서 기억 에 남 는 거보 다,,,,,,,,,,,,,,
"""수업 영상 들 도 오사마 빈 라덴 "," 9""",,,,,,,,,,,,,,
내용 이 내용 이 ㄴ지 라 흥미 가 없 다면 지루 하고 학점 받 기 어렵 ㄹ 수 도 있 어요,,,,,,,,,,,,,,
2 수업,,,,,,,,,,,,,,
성적 도 공부 하 ㄴ 만큼 나오 는 것 같 고 1 학년 동안 들 었 던 수업 중 에 가장 좋 았 던 수업 이 었 습니다,,,,,,,,,,,,,,
보충 수업 이 있 을 때 가 면 그날 배우 ㄴ 범위 내 에서 이것 은 시험 문제 에 내시 겠 다고 말씀 하 시 ㄴ 적 이 있 었 는데 그것 이 시험 에 나오 았 는지 아니 ㄴ지 는 기 ㄴ가 민가 하 ㅁ,,,,,,,,,,,,,,
일학 년 이 라 그런 가 일학 년 은 듣 지 말 아라 요,,,,,,,,,,,,,,
그래서 필기 정리 가 잘 안 되 고 그래서 시험 망 ...... 수업 자체 는 대학교 양다운 교양 이 에요,,,,,,,,,,,,,,
일학 년 은 왜 듣 지 마르 아 고 하 는지 여실히 느끼 었 당 .. 물론 대학 교양 답 은 강의 이 었 고 수업 도 흥미 있 고 퀄리티 도 높 았 다,,,,,,,,,,,,,,
열심 히 하 ㄹ 자신 없 으면 일학 년 들 은 학년 이 조금 더 올라서 들 으면 좋 을 것 같 다,,,,,,,,,,,,,,
수업 들 으면서 느끼 ㄴ 것 이 ㄴ데 고 학년 이랑 은 마인드 부터 가 다른 것 같 다,,,,,,,,,,,,,,
꿀 강의,,,,,,,,,,,,,,
상당히 필기 량 이 많 기 는 하지만 교양 답 은 교양 이 라고 생각 되 ㅂ니다,,,,,,,,,,,,,,
이런 식 으로 공부 하 면 망하 아요,,,,,,,,,,,,,,
진심 교양 다운 교양 의 끝판 왕,,,,,,,,,,,,,,
학점 이 문제 가 아니 라 그냥 학교 가 는 것 이 재밌 었 음,,,,,,,,,,,,,,
수업 은 재미있 었 고 유익 하 았 으며 고급 스럽 었 다,,,,,,,,,,,,,,
하지만 기 초도 없 고 아무것 도 모르 는 IT 대 이 처음 시작 하 기 에 는 나 벅차 ㄴ 수업 이 었 다,,,,,,,,,,,,,,
교선 은 제발 다시 생각 하고 이미 알 고 있 는 과목 아니 ㅁ,,,,,,,,,,,,,,
"""재미있 는 수업 "," 남 는 것 이 많 은 수업 이 었 음""",,,,,,,,,,,,,,
"""주로 국가 정보기관 들 과 정보사 들 을 주제 로 수업 을 진행 하 는데 "," 역사 의 비하인드 스토리 들 을 듣 는 것 같 아서 재미있 고 전직 외교관 이 시라 서 그렇 ㄴ지 전하 아 주 시 는 정보 들 도 공신력 이 있 습니다""",,,,,,,,,,,,,,
그러나 수업 의 질 은 진짜 대학 수업 같 았 습니다,,,,,,,,,,,,,,
정보활동 이 라는 것 에 대하 아서 무지 하 았었 는데 이 강의 를 통하 아서 많이 얻 고 가 ㅂ니다,,,,,,,,,,,,,,
대학 에서 얼마 못 듣 는 도움 되 는 수업 중 하나 지만,,,,,,,,,,,,,,
무지 하 았 던 역사적 사실 에 대하 어 깊 게 배우 면서 넓 은 관점 에서 배우 어요,,,,,,,,,,,,,,
관심 없 는데 들 으면 노잼 이 에 효 교수 님 은 진짜 좋 으시 었 던 ... 죄송 하 아요,,,,,,,,,,,,,,
교양 다운 수업 이 ㅂ니다,,,,,,,,,,,,,,
대학 강의 답 은 강의 라고 생각하 아 요,,,,,,,,,,,,,,
다 들 열심히 수업 들 으니 1 학년 은 신청 안 하 시 는 것 이 좋 은 것 같 습니다,,,,,,,,,,,,,,
5 점 주 고 싶 을 만큼 스파이 니 국제정치 니 관심 전혀 없 었 는데 도 하 ㄴ 학기 내내 재미있 고 유익 하 았 음,,,,,,,,,,,,,,
시간 맞 는 수업 찾 아 들어가 ㄴ 거라 이런 수업 이 ㄴ지 모르 았 음,,,,,,,,,,,,,,
"""지각 결석 없이 교수 님 말씀 다 받 아 적 었 는데 도 "," 시험 공부 를 열심 히 하 았 는데 도 아쉽 ㄴ 이유 는 시험 이 어 처 구니 없 는 것 이 끼 어서 나오 ㅁ""",,,,,,,,,,,,,,
그리고 제일 안 좋 았 던 것 은 이번 에 도 족보 가 돌 았 다는 소문 이 있 습니다,,,,,,,,,,,,,,
1 필기 가 많 습니다,,,,,,,,,,,,,,
2 내용 이 유익 하 ㄴ 지 모르 겠 습니다,,,,,,,,,,,,,,
무슨 이런 것 을 다 내 어 나 싶 은 문제 가 있 달 까요,,,,,,,,,,,,,,
저학년 은 힘들 ㄴ 강의 가 되 ㄹ 것 같 아 요 물론 저학년 중 에 도 열심히 하 아서 점수 잘 받 는 모습 보 기 ㄴ 하 았 지만 대부분 고 학년 선배 님 들 이 수업 을 열심히,,,,,,,,,,,,,,
저학년 들 은 피하 는 것 이 좋 은 과목 같 아요,,,,,,,,,,,,,,
세계 곳곳 에서 일어나 는 정보전 쟁 과 스파이 활동 에 대하 ㄴ 과목 이 았 다,,,,,,,,,,,,,,
필기 량 많 고 수업 이 빡 세 기 는 하지만 수업 내용 이 흥미 롭 고 또 배우 어 가 ㄴ다는 느낌 을 많이 받 았 어요,,,,,,,,,,,,,,
그만큼 학생과 소통 하 시 려고 많이 노력 하 시 는 것 같 아요,,,,,,,,,,,,,,
강의 듣 는 동안 관련 서적 을 찾아보 ㄹ 정도 로 재미있 었 습니다,,,,,,,,,,,,,,
1 수업 방식,,,,,,,,,,,,,,
"""전반적 으로 좀 틀이 없 는 수업 방식 이 랄까 ... 조문 "," 판결 위주 의 설명""",,,,,,,,,,,,,,
오픈 북 이 지만 오픈 하 ㄹ 북 이 없 다는 것 이 슬프 다,,,,,,,,,,,,,,
진정 하 ㄴ 대학 수업 이 라고 느끼 어 지 ㄴ 강의,,,,,,,,,,,,,,
한국 노동 계 에 관해 많 은 것 을 배우 ㄹ 수 있 음,,,,,,,,,,,,,,
처음 에 는 수업 에 두서 가 없 는 듯 하나 나름 체계 있 음,,,,,,,,,,,,,,
적응 되 면 고 수업 이 진짜 좋 음,,,,,,,,,,,,,,
.. 학점 은 .. 망하 ㄴ 줄 알 았 는데 A 0 나오 았 네요,,,,,,,,,,,,,,
학점 신경 쓰 면 듣 지 말 으시 어요,,,,,,,,,,,,,,
수업 즐겁 게 들 었 고 유익 하 ㄴ 내용 도 많이 알 게 되 었 어요,,,,,,,,,,,,,,
복전 생 이 듣기 에 도 쉽 게 수업 을 잘 가르치 시 ㄴ다,,,,,,,,,,,,,,
왜 별점 이 만점 이 ㄴ지 그 이유 를 알 끄 어 같 은 수업,,,,,,,,,,,,,,
저녁 수업 이 ㄴ데 한 시간 반 수업 하고 끝내 주 시 어서 제일 좋 았 음,,,,,,,,,,,,,,
수업 질 은 굉장히 떨어지 어서 약간 등록금 이 아깝 기 는 하 ㅂ니다 ..,,,,,,,,,,,,,,
그런데 저녁 6 시 730 시 수업 연 강인 데 수업 이 거의 730 에 끝나 서 기분 이 좋 기 는 하 ㅂ니다,,,,,,,,,,,,,,
굉장히 편하 ㄴ 수업 이 지만 얻 어 가 는 것 은 없 는 수업 이 라서 3 점 드리 ㅂ니다,,,,,,,,,,,,,,
조발 표 1 번 있 는데 크 게 부담 안 되 ㅁ,,,,,,,,,,,,,,
진짜 억울 하 아서 죽 여 버리 고 싶 어요,,,,,,,,,,,,,,
토론식 수업 이 ㄴ데 그냥 잘 모르 겠 어요,,,,,,,,,,,,,,
"""무엇 이 ㄴ가 를 배우 고 싶 으면 듣 지 말 고 "," 설렁설렁 공부 하고 싶 으면 들 으시 어요""",,,,,,,,,,,,,,
별로 별로 별로 진짜 별로 이 ㅂ 니 당 교수 님 이 뭘 말 하 려는지 잘 모르 겠 음,,,,,,,,,,,,,,
보 면 수업 끝나 ㅁ,,,,,,,,,,,,,,
원래 기말 없 었 는데 생기 ㄴ 것 ㄹ로 알 고 있 음,,,,,,,,,,,,,,
딱히 배우 는 것 은 없 고 배워가 는 것 은 없 어요,,,,,,,,,,,,,,
모든 강의 내용 이 ㄴ 머릿속 에 남 는 것 은 아니 지만 중간 과 기말 그리고 팀 프로젝트 하 면서 국제시장 조사 에 대하 아서 배우 는 것 은 확실히 있 는 듯,,,,,,,,,,,,,,
자격증 시험 은 진짜 시험 보 기 1,,,,,,,,,,,,,,
워드 자격증 만 따 면 패스,,,,,,,,,,,,,,
체 점 방식 전혀 모르 겠 다,,,,,,,,,,,,,,
기계공학 도 라면 유체역학 을 들 었 을 테 고 유체역학 을 듣 었 다면 실험 은 당근 생각 보다 실험 꿀 이 고 보고서 열 번 내 지만 부담 되 지 않 음,,,,,,,,,,,,,,
이론 수업 은 비 대면 으로 하 았 다,,,,,,,,,,,,,,
저 는 별로 .... 교수 님 이 뭘 가르치 어 주 시 는 지 모르 겠 어요,,,,,,,,,,,,,,
숭실대 생 을 상대 로 표본조사 팀 프로젝트 가 있 다,,,,,,,,,,,,,,
대학 오 아서 긴장 하 게 되 는 수업 오랜만 이였 어요,,,,,,,,,,,,,,
강의 력 이 남 다르 시 고 카리스마 있 으시 다,,,,,,,,,,,,,,
학점 채우 어 주 시 는 것 같 고 배우 ㄹ 것 이 많 은 수업 이 었 음,,,,,,,,,,,,,,
우선 오선영 교수 님 이랑 같 은 학기 에 같 은 과목 가르치 시 어서 학생 들 이 많이 듣 었 는데 강의 력 은 좀 떨어지 는 느낌 이 있 지만 재미있 으시 고 학생 을 배려 많이 하 아 주 시 어요,,,,,,,,,,,,,,
"""숙제 "," 조 모임 같 은 것 없이 수업 으로 만 진행 하 ㅂ니다""",,,,,,,,,,,,,,
지금 은 강의 를 알 ㄴ 하 는 것 같 지만 만약 다시 돌아오 ㄹ 경우 를 대비 하 아서 후기 를 쓰 자면 절대 들어서 ㄴ 안되 ㄹ 수업 이 ㅁ,,,,,,,,,,,,,,
모르 겠 으니까 우리 같이 배워가 요,,,,,,,,,,,,,,
저 는 정치 전공 이 라 경제 는 잘 모르 아요,,,,,,,,,,,,,,
수업 내용 도 잘 모르 는 듯,,,,,,,,,,,,,,
진짜 도움 많이 되 ㅂ니다,,,,,,,,,,,,,,
